review_id,ASIN,review_text,Star,review_time,_text,_score,_group,_id,sentiment,sentiment_conf,_neg_score,cluster_id
433,B06XL1B7QN,"Good, but.We like the leapfrog tablet but it appears that there are some slight improvements that could/should be made. the numbers are good until it gets to 10, which is listed as 01.the screen also doesn’t stay in one place in laptop mode, it’d be better if we could get it to not rotate at the slightest change.",3,2022-07-17,"Good, but.We like the leapfrog tablet but it appears that there are some slight improvements that could/should be made. the numbers are good until it gets to 10, which is listed as 01.the screen also doesn’t stay in one place in laptop mode, it’d be better if we could get it to not rotate at the slightest change.",3,B06XL1B7QN,432,negative,0.9729548096656799,1.8918192386627197,5
434,B06XL1B7QN,The screen doesn't lock in place.Great toy but the screen moves to easily that it's hard to keep in laptop mode and there is no way to lock in place,3,2022-07-9,The screen doesn't lock in place.Great toy but the screen moves to easily that it's hard to keep in laptop mode and there is no way to lock in place,3,B06XL1B7QN,433,negative,0.9987967014312744,1.9951868057250977,2
435,B06XL1B7QN,You can’t mute for meetings.There should be a mute feature.,3,2022-07-5,You can’t mute for meetings.There should be a mute feature.,3,B06XL1B7QN,434,negative,0.9900797605514526,1.9603190422058105,9
436,B06XL1B7QN,"So much potential hurt by usability.There are so many great things about this toy, but a few key drawbacks make it almost unusable.1. Contrast is terrible. It’s so difficult to see the images on the screen through the touch sensors. Worse, there’s no obvious use case for the touchscreen which doesn’t even seem to work. So it’s a stupid design since the kid can barely see what’s happening. The LCD lets too much of the blue light through the pixels… like watching a dark movie on a bad LCD TV.2. Volume only has two settings.",3,2022-07-3,"So much potential hurt by usability.There are so many great things about this toy, but a few key drawbacks make it almost unusable.1. Contrast is terrible. It’s so difficult to see the images on the screen through the touch sensors. Worse, there’s no obvious use case for the touchscreen which doesn’t even seem to work. So it’s a stupid design since the kid can barely see what’s happening. The LCD lets too much of the blue light through the pixels… like watching a dark movie on a bad LCD TV.2. Volume only has two settings.",3,B06XL1B7QN,435,negative,0.9996175765991211,1.9984703063964844,2
438,B06XL1B7QN,Ehhh….Nothing spectacular about this product. You can barely see the screen. Graphics are ancient. I’m a 90’s kid and nothing has changed since then. The pictures are more clear than the actual product. The screen flips around too easily. My toddler is off and on it often. Would not buy again,3,2022-04-24,Ehhh….Nothing spectacular about this product. You can barely see the screen. Graphics are ancient. I’m a 90’s kid and nothing has changed since then. The pictures are more clear than the actual product. The screen flips around too easily. My toddler is off and on it often. Would not buy again,3,B06XL1B7QN,437,negative,0.9763727188110352,1.9054908752441406,2
440,B06XL1B7QN,"The touch panel was broken.The touch panel was broken. This was a Christmas present for my son, so I couldn't make a return.",3,2022-02-11,"The touch panel was broken.The touch panel was broken. This was a Christmas present for my son, so I couldn't make a return.",3,B06XL1B7QN,439,negative,0.9991012811660767,1.9964051246643066,8
442,B06XL1B7QN,Disappointed :-(.Touch screen is not great. But I like the way how screen can be folded to use as an tablet.Overall OK toy for the price.My kid played with this Toy for a week or so and got bored of it.,3,2022-01-20,Disappointed :-(.Touch screen is not great. But I like the way how screen can be folded to use as an tablet.Overall OK toy for the price.My kid played with this Toy for a week or so and got bored of it.,3,B06XL1B7QN,441,negative,0.9929075241088867,1.9716300964355469,2
443,B06XL1B7QN,"No space bar?.My daughter got this for her birthday last year and her and her 3 year old sister love playing with it. I didn't notice it til today, but there's no space bar. How do you expect kids to type actual words? They don't care, I just thought it was odd. That and the letters aren't lined up like a keyboard so ya know. Volume has two settings and no headphone jack. Patience required.",3,2022-01-3,"No space bar?.My daughter got this for her birthday last year and her and her 3 year old sister love playing with it. I didn't notice it til today, but there's no space bar. How do you expect kids to type actual words? They don't care, I just thought it was odd. That and the letters aren't lined up like a keyboard so ya know. Volume has two settings and no headphone jack. Patience required.",3,B06XL1B7QN,442,negative,0.9987292885780334,1.9949171543121338,4
444,B06XL1B7QN,Not as great as expected.Gave it to our niece as a birthday present. Wasn’t as big of fan as I thought I’d be.,3,2021-12-3,Not as great as expected.Gave it to our niece as a birthday present. Wasn’t as big of fan as I thought I’d be.,3,B06XL1B7QN,443,negative,0.999488353729248,1.9979534149169922,7
445,B06XL1B7QN,"Not Durable.My child loved it, but the screen's swivel feature broke after an hour of light play.",3,2021-10-6,"Not Durable.My child loved it, but the screen's swivel feature broke after an hour of light play.",3,B06XL1B7QN,444,negative,0.998606264591217,1.9944250583648682,2
449,B06XL1B7QN,"Screen doesn't recognize touch in one portion after few months.Screen doesn't recognize touch in one portion after few months. It's frustrating since the bubbles can't touch or balloon with numbers and stuck without progressing from there. Sometimes it doesn't recognize the laptop mode, it should have recognized if the buttons are pressed as a fool proof design.",3,2021-06-11,"Screen doesn't recognize touch in one portion after few months.Screen doesn't recognize touch in one portion after few months. It's frustrating since the bubbles can't touch or balloon with numbers and stuck without progressing from there. Sometimes it doesn't recognize the laptop mode, it should have recognized if the buttons are pressed as a fool proof design.",3,B06XL1B7QN,448,negative,0.9993481040000916,1.9973924160003662,2
450,B06XL1B7QN,Sound is very low not happy with that.The sounds are very low,3,2020-07-3,Sound is very low not happy with that.The sounds are very low,3,B06XL1B7QN,449,negative,0.9997946619987488,1.9991786479949951,9
451,B06XL1B7QN,"For my 3 years daughter...As shown in the pictures I’ve uploaded, the screen is not clear visible..!",3,2020-06-30,"For my 3 years daughter...As shown in the pictures I’ve uploaded, the screen is not clear visible..!",3,B06XL1B7QN,450,negative,0.999763548374176,1.999054193496704,2
452,B06XL1B7QN,"Good, but not great.My only issue is the screen. Hard to see.",3,2020-05-21,"Good, but not great.My only issue is the screen. Hard to see.",3,B06XL1B7QN,451,negative,0.9920782446861267,1.9683129787445068,2
455,B06XL1B7QN,Purchased as a birthday gift.Item screen became loose and broke after just two hours. There are other LeapFrog products that have lasted me years so I am surprised this one didn't do so well. It was a gift for a two year old.,3,2020-01-13,Purchased as a birthday gift.Item screen became loose and broke after just two hours. There are other LeapFrog products that have lasted me years so I am surprised this one didn't do so well. It was a gift for a two year old.,3,B06XL1B7QN,454,negative,0.995959460735321,1.9838378429412842,5
456,B06XL1B7QN,"Though I bought new....The retail box was beaten up and the Leap Top was taped onto the box, batteries were already installed - and the parent manual was missing. I was going to give as a gift, but it didn’t look new. I feel that it was used and returned. It’s going in the babysit/nanny box.",3,2019-12-19,"Though I bought new....The retail box was beaten up and the Leap Top was taped onto the box, batteries were already installed - and the parent manual was missing. I was going to give as a gift, but it didn’t look new. I feel that it was used and returned. It’s going in the babysit/nanny box.",3,B06XL1B7QN,455,negative,0.9992243051528931,1.9968972206115723,8
457,B06XL1B7QN,Thats is Ok.I was disappointed because the screen came with a defect.,3,2019-10-15,Thats is Ok.I was disappointed because the screen came with a defect.,3,B06XL1B7QN,456,negative,0.9893741011619568,1.9574964046478271,2
458,B06XL1B7QN,its a cool toy.its a nice laptop but wish the battery lasted longer and that it was a bit more durable. but cant go wrong for the price! my son just gets bored on it too quickly,3,2019-10-7,its a cool toy.its a nice laptop but wish the battery lasted longer and that it was a bit more durable. but cant go wrong for the price! my son just gets bored on it too quickly,3,B06XL1B7QN,457,negative,0.9987327456474304,1.9949309825897217,6
464,B06XL1B7QN,"Better for a 1 or 2 year old. Not older.I expected way more content from this thing. Considering my 3 year old is already using an actual tablet, it's doubtful that this will entertaining to her for very long",3,2018-12-12,"Better for a 1 or 2 year old. Not older.I expected way more content from this thing. Considering my 3 year old is already using an actual tablet, it's doubtful that this will entertaining to her for very long",3,B06XL1B7QN,463,negative,0.9965724945068359,1.9862899780273438,4
465,B06XL1B7QN,Very upset daughter.The toy quit she's had it less than a year and it quit called LeapFrog and they will not exchange it or ask me to send it in to see what's the matter with it,3,2018-08-13,Very upset daughter.The toy quit she's had it less than a year and it quit called LeapFrog and they will not exchange it or ask me to send it in to see what's the matter with it,3,B06XL1B7QN,464,negative,0.9994584918022156,1.9978339672088623,8
466,B06XL1B7QN,It was cute and I liked the learning games.Worked well for awhile. It was bought for a Christmas gift and then all of the sudden stopped working the other day. The batteries were changed and nothing worked other than once when the toddler dropped it on the floor in tablet mode on the rug and it began to light up. Once shut off again nothing worked. It didn’t work again after that with new batteries in it. It was cute and I liked the learning games. We bought the tablet vtech instead.,3,2018-04-13,It was cute and I liked the learning games.Worked well for awhile. It was bought for a Christmas gift and then all of the sudden stopped working the other day. The batteries were changed and nothing worked other than once when the toddler dropped it on the floor in tablet mode on the rug and it began to light up. Once shut off again nothing worked. It didn’t work again after that with new batteries in it. It was cute and I liked the learning games. We bought the tablet vtech instead.,3,B06XL1B7QN,465,negative,0.9594900012016296,1.8379600048065186,5
468,B06XL1B7QN,Three Stars.It broke and stop working after one month,3,2018-03-17,Three Stars.It broke and stop working after one month,3,B06XL1B7QN,467,negative,0.9983571171760559,1.9934284687042236,0
469,B06XL1B7QN,"Why?.My toddler absolutely love it! However, after 10 months it just stopped working even after the batteries were replaced.",3,2018-02-11,"Why?.My toddler absolutely love it! However, after 10 months it just stopped working even after the batteries were replaced.",3,B06XL1B7QN,468,negative,0.9896246790885925,1.9584987163543701,6
470,B06XL1B7QN,"Great learning toy but...My 2 year old loved this toy so much. Everything it had to offer was great. Even when he wasn’t playing with it he would repeat the things he learned from it throughout the day. Unfortunately, it just stopped working without warning less than a month after purchasing it (wasn’t the batteries). Because he loved it so much, he was that much more devastated when it wouldn’t work. It was a amazing toy while it lasted but I’m not sure if I would replace it. Don’t really want to go through that again and by the looks of other reviews; this doesn’t seem like a rare occurrence.",3,2018-01-25,"Great learning toy but...My 2 year old loved this toy so much. Everything it had to offer was great. Even when he wasn’t playing with it he would repeat the things he learned from it throughout the day. Unfortunately, it just stopped working without warning less than a month after purchasing it (wasn’t the batteries). Because he loved it so much, he was that much more devastated when it wouldn’t work. It was a amazing toy while it lasted but I’m not sure if I would replace it. Don’t really want to go through that again and by the looks of other reviews; this doesn’t seem like a rare occurrence.",3,B06XL1B7QN,469,negative,0.989047110080719,1.956188440322876,4
671,B09MW38Z5F,Did not last.This broke pretty immediately,1,2026-01-7,Did not last.This broke pretty immediately,1,B09MW38Z5F,670,negative,0.9737492203712463,1.8949968814849854,0
672,B09MW38Z5F,"The pen stains so bad.I decided to return this product within 10 minutes of my daughter playing with it. The pen is the messiest thing ever, it stains her fingers so bad even washing her hands didn’t get rid of it right away, and not using the pen defeat the whole purpose of the book so I had to return it",1,2025-12-31,"The pen stains so bad.I decided to return this product within 10 minutes of my daughter playing with it. The pen is the messiest thing ever, it stains her fingers so bad even washing her hands didn’t get rid of it right away, and not using the pen defeat the whole purpose of the book so I had to return it",1,B09MW38Z5F,671,negative,0.9995741248130798,1.9982964992523193,1
673,B09MW38Z5F,"Bad quality, super disappointed.This was such a disappointment. I bought 10 of these for my son's birthday. But now I feel really embarrassed coz the one we got glitches and stops so much that my son has given up altogether. He initially found it appealing and tried to play with it, but it glitches everytime and then he's stopped playingIf the makers are reading this, please work to improve the quality. Would definitely not suggest as a gift for to quality concerns.",1,2025-12-25,"Bad quality, super disappointed.This was such a disappointment. I bought 10 of these for my son's birthday. But now I feel really embarrassed coz the one we got glitches and stops so much that my son has given up altogether. He initially found it appealing and tried to play with it, but it glitches everytime and then he's stopped playingIf the makers are reading this, please work to improve the quality. Would definitely not suggest as a gift for to quality concerns.",1,B09MW38Z5F,672,negative,0.9982243180274963,1.9928972721099854,8
674,B09MW38Z5F,Not working properly.My child wanted this for christmas and it won't work. The hint button flashes yellow as soon as I put batteries in and turned the product on. I will be having to return it and pray that the process is easy and doable.,1,2025-12-25,Not working properly.My child wanted this for christmas and it won't work. The hint button flashes yellow as soon as I put batteries in and turned the product on. I will be having to return it and pray that the process is easy and doable.,1,B09MW38Z5F,673,negative,0.9990505576133728,1.9962022304534912,3
675,B09MW38Z5F,"Disappointing.This was on someone else’s wish list so I bought it for her child. When I received it I put it away until the day of the birthday party. Then about an hour before I went to put it in a gift bag and head to the party I realized the box was torn, then the book fell out completely and I saw it was dirty and missing the pen. I frantically had to go out and buy another gift. I ended up buying another present and then some dry erase markers and I cleaned this up and gave her son the book too. That’s the only reason I didn’t return it. This was supposed to be new not used. Disappointing.",1,2025-11-13,"Disappointing.This was on someone else’s wish list so I bought it for her child. When I received it I put it away until the day of the birthday party. Then about an hour before I went to put it in a gift bag and head to the party I realized the box was torn, then the book fell out completely and I saw it was dirty and missing the pen. I frantically had to go out and buy another gift. I ended up buying another present and then some dry erase markers and I cleaned this up and gave her son the book too. That’s the only reason I didn’t return it. This was supposed to be new not used. Disappointing.",1,B09MW38Z5F,674,negative,0.9997361302375793,1.9989445209503174,8
676,B09MW38Z5F,"Super messy marker....We wanted & tried to love this for our toddler girl age 3. But the marker is soo super messy & while it's washable, it's not as easy as it should be to clean off. And, of course I'm outside the return window so we're stuck with it.",1,2025-04-16,"Super messy marker....We wanted & tried to love this for our toddler girl age 3. But the marker is soo super messy & while it's washable, it's not as easy as it should be to clean off. And, of course I'm outside the return window so we're stuck with it.",1,B09MW38Z5F,675,negative,0.998298704624176,1.993194818496704,1
677,B09MW38Z5F,Junk.Left side isn't working,1,2025-03-26,Junk.Left side isn't working,1,B09MW38Z5F,676,negative,0.9997021555900574,1.9988086223602295,3
678,B09MW38Z5F,Bought for Christmas.It was missing the dry erase marker,1,2025-02-27,Bought for Christmas.It was missing the dry erase marker,1,B09MW38Z5F,677,negative,0.9996994733810425,1.99879789352417,1
679,B09MW38Z5F,Don’t recommend.Was really excited for this but it is not great. Marker stains kids fingers and other things. Functionality is not good either. My son has tried to use it a few times and after this last time I think we are just going to trash it. Disappointed as I really liked the idea of it.,1,2025-02-16,Don’t recommend.Was really excited for this but it is not great. Marker stains kids fingers and other things. Functionality is not good either. My son has tried to use it a few times and after this last time I think we are just going to trash it. Disappointed as I really liked the idea of it.,1,B09MW38Z5F,678,negative,0.9996140599250793,1.9984562397003174,4
680,B09MW38Z5F,Hard even for me to work.This just wasn't planned out well. It doesn't function properly and many times will cause frustration even in adults.  My son was about 2 when I got this for him and he never got it figured out (nor did i) I just threw it out. I don't really think there is anything to learn from this toy since it's so difficult to use. Honestly it's trash don't waste your money,1,2025-02-16,Hard even for me to work.This just wasn't planned out well. It doesn't function properly and many times will cause frustration even in adults.  My son was about 2 when I got this for him and he never got it figured out (nor did i) I just threw it out. I don't really think there is anything to learn from this toy since it's so difficult to use. Honestly it's trash don't waste your money,1,B09MW38Z5F,679,negative,0.9993684887886047,1.997473955154419,4
681,B09MW38Z5F,Marker doesn't come with eraser!.This marker gets EVERYWHERE and doesn't come with an eraser. Definitely not the mess we needed.,1,2024-12-26,Marker doesn't come with eraser!.This marker gets EVERYWHERE and doesn't come with an eraser. Definitely not the mess we needed.,1,B09MW38Z5F,680,negative,0.9987228512763977,1.9948914051055908,1
682,B09MW38Z5F,Everything arrived damaged and won't let me exchange.Everything was soaked. The entire order and every item inside was soaking wet. How am I supposed to give this as a christmas gift?!,1,2024-11-28,Everything arrived damaged and won't let me exchange.Everything was soaked. The entire order and every item inside was soaking wet. How am I supposed to give this as a christmas gift?!,1,B09MW38Z5F,681,negative,0.9974971413612366,1.9899885654449463,8
683,B09MW38Z5F,Pen is missing.We received the product without the pen,1,2024-11-2,Pen is missing.We received the product without the pen,1,B09MW38Z5F,682,negative,0.9997705817222595,1.999082326889038,1
684,B09MW38Z5F,Missing pieces.Arrived with packaging destroyed and missing the pen. Had to pay $7 to return an unusable product.,1,2024-06-19,Missing pieces.Arrived with packaging destroyed and missing the pen. Had to pay $7 to return an unusable product.,1,B09MW38Z5F,683,negative,0.9998013377189636,1.9992053508758545,1
685,B09MW38Z5F,The Marker is missing.Received the learning book quick but the marker pen is missing. Unhappy with the order!!,1,2024-05-11,The Marker is missing.Received the learning book quick but the marker pen is missing. Unhappy with the order!!,1,B09MW38Z5F,684,negative,0.9997779726982117,1.9991118907928467,1
686,B09MW38Z5F,"Over priced.Overall, it’s overpriced. The marker was dried out. The functions at the top of the page weren’t adequate with instructions when the toy spoke, maybe it’s a defect.",1,2024-05-3,"Over priced.Overall, it’s overpriced. The marker was dried out. The functions at the top of the page weren’t adequate with instructions when the toy spoke, maybe it’s a defect.",1,B09MW38Z5F,685,negative,0.9997993111610413,1.999197244644165,8
687,B09MW38Z5F,Came without the erasable marker.This product did not come with a Erasable marker!,1,2023-11-30,Came without the erasable marker.This product did not come with a Erasable marker!,1,B09MW38Z5F,686,negative,0.9975581169128418,1.9902324676513672,1
688,B09MW38Z5F,Can’t use without the pen that goes with it and twice I ordered and twice no pen.Read above not writing it several more times,1,2023-10-31,Can’t use without the pen that goes with it and twice I ordered and twice no pen.Read above not writing it several more times,1,B09MW38Z5F,687,negative,0.9723657369613647,1.889462947845459,1
689,B09MW38Z5F,Missing marker.The book came without the erasable marker.,1,2023-09-20,Missing marker.The book came without the erasable marker.,1,B09MW38Z5F,688,negative,0.9993768334388733,1.9975073337554932,1
690,B09MW38Z5F,"I have a serious problem with this product.Bought this for my three-year-old grandson who is very smart. I marker wipes off of the book, but stained his fingers and won’t come off with warm soap and water!",1,2023-09-18,"I have a serious problem with this product.Bought this for my three-year-old grandson who is very smart. I marker wipes off of the book, but stained his fingers and won’t come off with warm soap and water!",1,B09MW38Z5F,689,negative,0.995227575302124,1.980910301208496,4
691,B09MW38Z5F,Game came without the washable marker for use on the tablet.Disappointing when washable marker missing from toy.  Shouldn't products be inspected prior to being shipped to customers?,1,2023-07-30,Game came without the washable marker for use on the tablet.Disappointing when washable marker missing from toy.  Shouldn't products be inspected prior to being shipped to customers?,1,B09MW38Z5F,690,negative,0.9995889067649841,1.9983556270599365,8
692,B09MW38Z5F,"Defective.Arrived DOA, didn’t open right away bc we moved. Changed batteries and still didn’t work.",1,2023-07-14,"Defective.Arrived DOA, didn’t open right away bc we moved. Changed batteries and still didn’t work.",1,B09MW38Z5F,691,negative,0.9996908903121948,1.9987635612487793,6
693,B09MW38Z5F,Pen missing.Pen missing,1,2023-06-29,Pen missing.Pen missing,1,B09MW38Z5F,692,negative,0.9997562766075134,1.9990251064300537,1
694,B09MW38Z5F,Pésimo servicio.El juguete vino con las pilas colocadas y se encontraban en mal estado. Ya cambie las pilas y limpie el conector pero sigue sin funcionar.,1,2023-06-18,Pésimo servicio.El juguete vino con las pilas colocadas y se encontraban en mal estado. Ya cambie las pilas y limpie el conector pero sigue sin funcionar.,1,B09MW38Z5F,693,negative,0.9836507439613342,1.934602975845337,0
695,B09MW38Z5F,"Work well but there was no pen in the package.Everything was just works fine except It missed the pen for the last couple pages on the back. I did not realize it until acouple day later that we use the pen for the back of this book. it passed the return day, so I coud  not return it.",1,2023-05-13,"Work well but there was no pen in the package.Everything was just works fine except It missed the pen for the last couple pages on the back. I did not realize it until acouple day later that we use the pen for the back of this book. it passed the return day, so I coud  not return it.",1,B09MW38Z5F,694,negative,0.9818352460861206,1.9273409843444824,1
696,B09MW38Z5F,Missing item.I didn’t get a pen with my order.,1,2023-05-12,Missing item.I didn’t get a pen with my order.,1,B09MW38Z5F,695,negative,0.9997057318687439,1.9988229274749756,1
697,B09MW38Z5F,Damaged item sent and missing pen.Damaged item sent and missing pen,1,2023-03-8,Damaged item sent and missing pen.Damaged item sent and missing pen,1,B09MW38Z5F,696,negative,0.9997381567955017,1.9989526271820068,1
698,B09MW38Z5F,Missing the eraser/ marker?.What’s the point of this product without the marker?,1,2023-01-14,Missing the eraser/ marker?.What’s the point of this product without the marker?,1,B09MW38Z5F,697,negative,0.9997715353965759,1.9990861415863037,1
