review_id,ASIN,review_text,Star,review_time,_text,_score,_group,_id,sentiment,sentiment_conf,_neg_score,cluster_id
1071,B01FVS6V9Y,"Had a leg missing from stool, chair unusable.I like the product, but was disappointed that the leg of the chair was missing.  I had a previous model, so I could use the other chair; but would have been nice to have it in the condition it was sold in “like new”.",3,2022-11-12,"Had a leg missing from stool, chair unusable.I like the product, but was disappointed that the leg of the chair was missing.  I had a previous model, so I could use the other chair; but would have been nice to have it in the condition it was sold in “like new”.",3,B01FVS6V9Y,1070,negative,0.9977748990058899,1.9910995960235596,8
1075,B01FVS6V9Y,Missing chair legs.Missing chair legs.,3,2022-01-5,Missing chair legs.Missing chair legs.,3,B01FVS6V9Y,1074,negative,0.9996713399887085,1.998685359954834,1
1076,B01FVS6V9Y,"Could use improvement.It's adorable and colorful. Wish it was more stable. Everytime we flip it up into a drawing position, it would fall back completely no matter how hard we hit it to stabilize the attachment on the sides. Finally gave up. Wish there was more options.",3,2022-01-3,"Could use improvement.It's adorable and colorful. Wish it was more stable. Everytime we flip it up into a drawing position, it would fall back completely no matter how hard we hit it to stabilize the attachment on the sides. Finally gave up. Wish there was more options.",3,B01FVS6V9Y,1075,negative,0.9973331689834595,1.989332675933838,4
1078,B01FVS6V9Y,"Perfect gift to torment parents..Are you looking for a gift to torment parents but feel that a full drum set is too obvious?  Well do I have a gift idea for you.The volume control is on the front and to the full discretion of the children.  You might be surprised to learn that the volume down button is not very popular.  There is zero tactical feedback letting them know they are unintentionally touching different buttons on the table and do not seem to care the audio response is constantly repeating that no, that was not the correct letter of the alphabet that was requested.  And because the table is so positve and encouraging to the children, there is seemingly no end to the full volume incorrect responses.",3,2021-12-20,"Perfect gift to torment parents..Are you looking for a gift to torment parents but feel that a full drum set is too obvious?  Well do I have a gift idea for you.The volume control is on the front and to the full discretion of the children.  You might be surprised to learn that the volume down button is not very popular.  There is zero tactical feedback letting them know they are unintentionally touching different buttons on the table and do not seem to care the audio response is constantly repeating that no, that was not the correct letter of the alphabet that was requested.  And because the table is so positve and encouraging to the children, there is seemingly no end to the full volume incorrect responses.",3,B01FVS6V9Y,1077,negative,0.9994943141937256,1.9979772567749023,4
1079,B01FVS6V9Y,Safety of a toy.It’s great for learning. My grand daughter leaned against it it fell apart. My grand daughter is 3 and petite. The safety of it is it’s not sturdy.,3,2021-11-26,Safety of a toy.It’s great for learning. My grand daughter leaned against it it fell apart. My grand daughter is 3 and petite. The safety of it is it’s not sturdy.,3,B01FVS6V9Y,1078,negative,0.9973220229148865,1.989288091659546,4
1080,B01FVS6V9Y,Seat missing.It was missing the seat,3,2021-10-14,Seat missing.It was missing the seat,3,B01FVS6V9Y,1079,negative,0.9997616410255432,1.9990465641021729,1
1081,B01FVS6V9Y,"Too complicated.I purchase his for my son who turned year a few days ago. I wanted to love it, but it's far too advanced and frustrating.",3,2021-09-25,"Too complicated.I purchase his for my son who turned year a few days ago. I wanted to love it, but it's far too advanced and frustrating.",3,B01FVS6V9Y,1080,negative,0.9974719882011414,1.9898879528045654,8
1086,B01FVS6V9Y,No 2 tables are the same..I wish the pages we have from our other VTech table (that broke) would be recognizable in the new one... The other one we had was much better,3,2021-05-10,No 2 tables are the same..I wish the pages we have from our other VTech table (that broke) would be recognizable in the new one... The other one we had was much better,3,B01FVS6V9Y,1085,negative,0.998863935470581,1.9954557418823242,1
1087,B01FVS6V9Y,Expansion packs need but doesn’t come with this product..Is wasn’t clear when I bought this for my grandson that you really need the expansion packs to make the product usable.  And the expansion packs are really expensive.  I don’t recommend you buy unless you also buy one of the expansion packs.,3,2021-04-20,Expansion packs need but doesn’t come with this product..Is wasn’t clear when I bought this for my grandson that you really need the expansion packs to make the product usable.  And the expansion packs are really expensive.  I don’t recommend you buy unless you also buy one of the expansion packs.,3,B01FVS6V9Y,1086,negative,0.9971559047698975,1.9886236190795898,8
1088,B01FVS6V9Y,Missing parts..Stool didn't come with the legs.,3,2021-04-5,Missing parts..Stool didn't come with the legs.,3,B01FVS6V9Y,1087,negative,0.9976625442504883,1.9906501770019531,1
1089,B01FVS6V9Y,Sometimes it works and sometimes it doesn't.We've had this for over a year now. It's a great learning tool. My only issue is that it doesn't want to read half of the extra pages we purchased with it anymore. It's very disappointing because we spent extra money on them. Sometimes it will read one side of a page but not the other and some pages won't work at all. They are the correct ones for the desk too and have worked in the past.,3,2021-03-18,Sometimes it works and sometimes it doesn't.We've had this for over a year now. It's a great learning tool. My only issue is that it doesn't want to read half of the extra pages we purchased with it anymore. It's very disappointing because we spent extra money on them. Sometimes it will read one side of a page but not the other and some pages won't work at all. They are the correct ones for the desk too and have worked in the past.,3,B01FVS6V9Y,1088,negative,0.9938861727714539,1.9755446910858154,4
1090,B01FVS6V9Y,Legs won’t stay on the stool.The activity desk itself is great however the legs on the stools do not stay on. As soon as the kids pick up the stools the legs come falling off. It doesn’t matter how hard you push them in they never snap in. I bought 2 so now I have 8 legs strewn about since the boys use them for everything else. This desk would’ve been great if it weren’t for that.,3,2021-03-6,Legs won’t stay on the stool.The activity desk itself is great however the legs on the stools do not stay on. As soon as the kids pick up the stools the legs come falling off. It doesn’t matter how hard you push them in they never snap in. I bought 2 so now I have 8 legs strewn about since the boys use them for everything else. This desk would’ve been great if it weren’t for that.,3,B01FVS6V9Y,1089,negative,0.9735510945320129,1.8942043781280518,4
1091,B01FVS6V9Y,"not expandable.the desk comes with many activity sheets, but you can't use them without the ""cartridge."" vtech doesn't sell the cartridges. so really you can only do maybe 3 activities. the sound quality is poor.",3,2021-02-27,"not expandable.the desk comes with many activity sheets, but you can't use them without the ""cartridge."" vtech doesn't sell the cartridges. so really you can only do maybe 3 activities. the sound quality is poor.",3,B01FVS6V9Y,1090,negative,0.9994685053825378,1.9978740215301514,4
1092,B01FVS6V9Y,Volume quit working.Volume quit working within two weeks of use. It’s now stuck on lowest level.,3,2021-02-27,Volume quit working.Volume quit working within two weeks of use. It’s now stuck on lowest level.,3,B01FVS6V9Y,1091,negative,0.9997960925102234,1.9991843700408936,0
1093,B01FVS6V9Y,Did not last long.Used about 5 times and now it doesn't work. Very disappointed.,3,2021-02-13,Did not last long.Used about 5 times and now it doesn't work. Very disappointed.,3,B01FVS6V9Y,1092,negative,0.9996848106384277,1.998739242553711,0
1094,B01FVS6V9Y,Nicer with chair probably.Table was great but didn't get a chair with ours.,3,2021-02-2,Nicer with chair probably.Table was great but didn't get a chair with ours.,3,B01FVS6V9Y,1093,negative,0.9704716801643372,1.8818867206573486,7
1095,B01FVS6V9Y,"Unsafe stool.The legs on the stool fall out easily making the stool unsafe for children around the age of 3 who are simply playing with it and are not aware of the dangers of the loose legs. My son has gotten hurt a several times after having moved the stool closer to the desk and wasn't aware a leg fell out in the process and when he sat down, the stool collapsed under him, once causing him to fall face first into the desk. Frustrating because he likes the desk and I never expect the legs on the stool to be an issue.",3,2021-01-27,"Unsafe stool.The legs on the stool fall out easily making the stool unsafe for children around the age of 3 who are simply playing with it and are not aware of the dangers of the loose legs. My son has gotten hurt a several times after having moved the stool closer to the desk and wasn't aware a leg fell out in the process and when he sat down, the stool collapsed under him, once causing him to fall face first into the desk. Frustrating because he likes the desk and I never expect the legs on the stool to be an issue.",3,B01FVS6V9Y,1094,negative,0.9984830021858215,1.9939320087432861,4
1096,B01FVS6V9Y,it's great overall.I like the product it teaches a lot it sings and interacts with my son but I'm having a problem snapping the activity desk down it wont stay my son can take it off and carry it,3,2021-01-7,it's great overall.I like the product it teaches a lot it sings and interacts with my son but I'm having a problem snapping the activity desk down it wont stay my son can take it off and carry it,3,B01FVS6V9Y,1095,negative,0.97699373960495,1.9079749584197998,4
1097,B01FVS6V9Y,"Partially working product.I would give this a full 5 stars, but I am disappointed in the fact that one of the two other cards, on both sides, provided does not work. It says it is not compatible. It came with ""Fruits & Colors"" and ""Numbers & Counting"", which DOES work, but the card with ""Human Body"" and ""Music Jammer"" does NOT work. It comes with enough to entertain my son, but this was purchased for ALL the learning opportunities it provides, not half of them",3,2020-12-27,"Partially working product.I would give this a full 5 stars, but I am disappointed in the fact that one of the two other cards, on both sides, provided does not work. It says it is not compatible. It came with ""Fruits & Colors"" and ""Numbers & Counting"", which DOES work, but the card with ""Human Body"" and ""Music Jammer"" does NOT work. It comes with enough to entertain my son, but this was purchased for ALL the learning opportunities it provides, not half of them",3,B01FVS6V9Y,1096,negative,0.9984275102615356,1.9937100410461426,5
1098,B01FVS6V9Y,Cool activites but.......Human body activity card is not functioning. All others are except for this one.,3,2020-12-25,Cool activites but.......Human body activity card is not functioning. All others are except for this one.,3,B01FVS6V9Y,1097,negative,0.9982960820198059,1.9931843280792236,5
1099,B01FVS6V9Y,Check item if you get open box..I bought 2 pink and purple ones. Was sent 1 pink and purple and 1 red and yellow. I wanted 2 of the same color as my twins get upset if they don't have the exact same thing.*Edit* I will be sending this back. I started pulling it out and it is absolutely disgusting!,3,2020-12-25,Check item if you get open box..I bought 2 pink and purple ones. Was sent 1 pink and purple and 1 red and yellow. I wanted 2 of the same color as my twins get upset if they don't have the exact same thing.*Edit* I will be sending this back. I started pulling it out and it is absolutely disgusting!,3,B01FVS6V9Y,1098,negative,0.9983526468276978,1.993410587310791,8
1101,B01FVS6V9Y,ok.the top half comes off easily and doesn't stay put,3,2020-12-11,ok.the top half comes off easily and doesn't stay put,3,B01FVS6V9Y,1100,negative,0.9960442781448364,1.9841771125793457,7
1102,B01FVS6V9Y,Fun for kids but dangerous on non carpeted floors..The table its self is good and has alot of features that my 2 year old son enjoys. But be careful if you have wood floors. The table and chair have nothing on the bottom of the legs to prevent it from slipping on non carpeted floors. The first time my son tried to sit down the chair slid out from underneath him and he fell hitting his head on the floor. If you plan on buying this get some non slip pads to stick on the bottom of the legs to prevent your children from being hurt.,3,2020-12-2,Fun for kids but dangerous on non carpeted floors..The table its self is good and has alot of features that my 2 year old son enjoys. But be careful if you have wood floors. The table and chair have nothing on the bottom of the legs to prevent it from slipping on non carpeted floors. The first time my son tried to sit down the chair slid out from underneath him and he fell hitting his head on the floor. If you plan on buying this get some non slip pads to stick on the bottom of the legs to prevent your children from being hurt.,3,B01FVS6V9Y,1101,negative,0.9923415184020996,1.9693660736083984,4
1103,B01FVS6V9Y,Complicated.Hard time to assemble,3,2020-10-31,Complicated.Hard time to assemble,3,B01FVS6V9Y,1102,negative,0.9996620416641235,1.9986481666564941,1
1105,B01FVS6V9Y,Broken button!.The Activity button is broken! Have to take it every time I use that feature! Not satisified!,3,2020-10-15,Broken button!.The Activity button is broken! Have to take it every time I use that feature! Not satisified!,3,B01FVS6V9Y,1104,negative,0.9996515512466431,1.9986062049865723,3
1107,B01FVS6V9Y,"Better for children over 3 years..I was really excited to give this to my toddler, but even though he seems to be enjoying it, I’m frustrated by how finicky it is.For example, when he’s playing the search game for the alphabet and he has to find the letter S, if he doesn’t press exactly in the middle of the letter box, it either doesn’t do anything, or it thinks he’s pressing the letter beside or beneath S. I don’t like that he’s choosing the right letter and being told he got it wrong, it doesn’t seem like that’s going to help him learn.And I wish the phone part came away from the backboard like the letter writing part does. Because when he’s trying to play “phone a friend”, if he accidentally puts his hand on the board and touches a letter when he’s reaching over to touch the numbers on the keypad, it ends the “phone a friend” game and he has to start all over again.He’s only 2 yrs 9 months, so hopefully as he gets older he’ll be better able to avoid accidentally touching letters while using the phone toy, and he’ll be able to more precisely press the letters on the board so that they actually work.",3,2020-09-11,"Better for children over 3 years..I was really excited to give this to my toddler, but even though he seems to be enjoying it, I’m frustrated by how finicky it is.For example, when he’s playing the search game for the alphabet and he has to find the letter S, if he doesn’t press exactly in the middle of the letter box, it either doesn’t do anything, or it thinks he’s pressing the letter beside or beneath S. I don’t like that he’s choosing the right letter and being told he got it wrong, it doesn’t seem like that’s going to help him learn.And I wish the phone part came away from the backboard like the letter writing part does. Because when he’s trying to play “phone a friend”, if he accidentally puts his hand on the board and touches a letter when he’s reaching over to touch the numbers on the keypad, it ends the “phone a friend” game and he has to start all over again.He’s only 2 yrs 9 months, so hopefully as he gets older he’ll be better able to avoid accidentally touching letters while using the phone toy, and he’ll be able to more precisely press the letters on the board so that they actually work.",3,B01FVS6V9Y,1106,negative,0.9990654587745667,1.9962618350982666,4
1109,B01FVS6V9Y,Disappointed.Who do u contact i receive my order but it didnt come with the 5 pages of activity included,3,2020-07-2,Disappointed.Who do u contact i receive my order but it didnt come with the 5 pages of activity included,3,B01FVS6V9Y,1108,negative,0.9985223412513733,1.9940893650054932,0
1111,B01FVS6V9Y,Good buy.Didnt like that you have to buy other activities separate,3,2020-06-1,Good buy.Didnt like that you have to buy other activities separate,3,B01FVS6V9Y,1110,negative,0.9398260116577148,1.7593040466308594,4
1112,B01FVS6V9Y,This product was incomplete in comparison to the 2nd one I bought.This product came with an extra mat that I could not use because it did not have a cartridge. Luckily I bought the activity package so I was able to use it though I had an extra one. I purchase a second one and realized that it was much better it came with 2 extra mats and I did not need cartridges for it.,3,2020-04-25,This product was incomplete in comparison to the 2nd one I bought.This product came with an extra mat that I could not use because it did not have a cartridge. Luckily I bought the activity package so I was able to use it though I had an extra one. I purchase a second one and realized that it was much better it came with 2 extra mats and I did not need cartridges for it.,3,B01FVS6V9Y,1111,negative,0.9956631064414978,1.9826524257659912,8
1113,B01FVS6V9Y,Okay.The table top isn’t secure. My one year old keeps taking it off.,3,2020-03-12,Okay.The table top isn’t secure. My one year old keeps taking it off.,3,B01FVS6V9Y,1112,negative,0.9989721775054932,1.9958887100219727,4
1114,B01FVS6V9Y,A little ticked.They no longer manufacture the expansion packs so the activity level doesn’t advance with your child.Very disappointing.,3,2020-03-7,A little ticked.They no longer manufacture the expansion packs so the activity level doesn’t advance with your child.Very disappointing.,3,B01FVS6V9Y,1113,negative,0.9996875524520874,1.9987502098083496,4
1116,B01FVS6V9Y,Small and cute.My kid got bored of it pretty fast. We use it more like a simple table and chair.,3,2020-02-28,Small and cute.My kid got bored of it pretty fast. We use it more like a simple table and chair.,3,B01FVS6V9Y,1115,negative,0.9789164066314697,1.915665626525879,4
1117,B01FVS6V9Y,Just ok.It is rather cheap. The plastic chair appears to be able to break at any time.,3,2020-02-18,Just ok.It is rather cheap. The plastic chair appears to be able to break at any time.,3,B01FVS6V9Y,1116,negative,0.993081271648407,1.972325086593628,4
1119,B01FVS6V9Y,Attention with chair.However the chair is too small not safe. I jad to buy another one.,3,2020-02-7,Attention with chair.However the chair is too small not safe. I jad to buy another one.,3,B01FVS6V9Y,1118,negative,0.9991722106933594,1.9966888427734375,4
1120,B01FVS6V9Y,Disappointed.The product description said when you flip the desk over you have a chalkboard surface...when I received mine it was only a plastic surface. So I am more then dissatisfied to say the least and VTech doesn’t have customer service in my country. Also Amazon custom service gave me the runaround without having a contact email or place to make this valid complaint.,3,2020-01-13,Disappointed.The product description said when you flip the desk over you have a chalkboard surface...when I received mine it was only a plastic surface. So I am more then dissatisfied to say the least and VTech doesn’t have customer service in my country. Also Amazon custom service gave me the runaround without having a contact email or place to make this valid complaint.,3,B01FVS6V9Y,1119,negative,0.9994218349456787,1.9976873397827148,5
1123,B01FVS6V9Y,Ok.Screws where missing for table and legs would not stay in chair,3,2020-01-4,Ok.Screws where missing for table and legs would not stay in chair,3,B01FVS6V9Y,1122,negative,0.9281376004219055,1.712550401687622,1
1124,B01FVS6V9Y,Just wish it were more sturdy.Got this for my 2 year old who gets most of the enjoyment from taking it apart. I wish it were not this easy for him to remove the legs or remove the top part of the desk (the part that does all of the talking). He played with it for a good 5 mins and it doesn't seem to hold his attention any longer than that (unless he's sneaking and taking it apart).,3,2019-12-27,Just wish it were more sturdy.Got this for my 2 year old who gets most of the enjoyment from taking it apart. I wish it were not this easy for him to remove the legs or remove the top part of the desk (the part that does all of the talking). He played with it for a good 5 mins and it doesn't seem to hold his attention any longer than that (unless he's sneaking and taking it apart).,3,B01FVS6V9Y,1123,negative,0.9987242817878723,1.9948971271514893,4
1126,B01FVS6V9Y,Learning toys.The interchangeable cards is not something that’s age appropriate. A two year old is not going to be careful with them and damage them quickly. They are okay to be used under supervision only,3,2019-12-26,Learning toys.The interchangeable cards is not something that’s age appropriate. A two year old is not going to be careful with them and damage them quickly. They are okay to be used under supervision only,3,B01FVS6V9Y,1125,negative,0.9900752902030945,1.960301160812378,4
1127,B01FVS6V9Y,"Umm.Not sure if expansion bundle packs will be back in stock, if they are I will update my review but if not I wasted money for sure. Planned on getting the bundle, whole reason I got the desk but silly me didnt order them at the same time and and now they're saying they are no longer available and the individuals are saying collectable on them, tad bit disgruntled I cant find any information online soooo hopefully they come back in stock and they didnt stop making them.",3,2019-12-24,"Umm.Not sure if expansion bundle packs will be back in stock, if they are I will update my review but if not I wasted money for sure. Planned on getting the bundle, whole reason I got the desk but silly me didnt order them at the same time and and now they're saying they are no longer available and the individuals are saying collectable on them, tad bit disgruntled I cant find any information online soooo hopefully they come back in stock and they didnt stop making them.",3,B01FVS6V9Y,1126,negative,0.9995254278182983,1.9981017112731934,8
1128,B01FVS6V9Y,"Good BUT Also REALLY Bad!.I bought this for my daughter about 3 years ago along with Learn to Read expansion pack so if have it on hand when she was at the age and ready to start learning to read. She is 4 years old now and still plays with this table and the little chair is something she uses on a daily basis to either sit a the tabel with or mainly she uses it as a step stool to reach the sink to wash her hands or the counter to help me cook (use your own Judy as a parent as to whether your child can use this to stand on). While the table has always worked and my daughter still plays with it to this day and learned from it, there is a HUGE disappointment to it. The extra Expansion Pack I bought with it back when I first purchased the table about 3 years ago, it DOES NOT WORK!! 😡😡😡 I didn't think to check to see if it worked with and was comparable with the table back when I first bought it because IT SAYS IT WAS! So now I have a useless pack that my daughter should now be able to use and wants to so bad, but she can't because it's absolutely useless and not compatible with the table like it should be. Wish I could get my money back but it's obviously been way to long.",3,2019-12-22,"Good BUT Also REALLY Bad!.I bought this for my daughter about 3 years ago along with Learn to Read expansion pack so if have it on hand when she was at the age and ready to start learning to read. She is 4 years old now and still plays with this table and the little chair is something she uses on a daily basis to either sit a the tabel with or mainly she uses it as a step stool to reach the sink to wash her hands or the counter to help me cook (use your own Judy as a parent as to whether your child can use this to stand on). While the table has always worked and my daughter still plays with it to this day and learned from it, there is a HUGE disappointment to it. The extra Expansion Pack I bought with it back when I first purchased the table about 3 years ago, it DOES NOT WORK!! 😡😡😡 I didn't think to check to see if it worked with and was comparable with the table back when I first bought it because IT SAYS IT WAS! So now I have a useless pack that my daughter should now be able to use and wants to so bad, but she can't because it's absolutely useless and not compatible with the table like it should be. Wish I could get my money back but it's obviously been way to long.",3,B01FVS6V9Y,1127,negative,0.9997382760047913,1.998953104019165,4
1129,B01FVS6V9Y,Buy if you don’t have choice..I like the concept but it very light and it doesn’t hold its ground on a wooden floor. It would be better if they add the rubber on the legs so it doesn’t move.,3,2019-12-15,Buy if you don’t have choice..I like the concept but it very light and it doesn’t hold its ground on a wooden floor. It would be better if they add the rubber on the legs so it doesn’t move.,3,B01FVS6V9Y,1128,negative,0.9819793701171875,1.92791748046875,4
