review_id,ASIN,review_text,Star,review_time,sentiment
1281,B01FVS6V9Y,Great educational toy..By far my 3 year old grandson’s favourite toy and educational too. It has helped him with his letter forming. He uses it every day.,5,2025-06-3,positive
1282,B01FVS6V9Y,My baby loves it.Loved it,5,2025-05-25,positive
1283,B01FVS6V9Y,Baby girl learning.My grand daughter loves it it is so cute to see her learn,5,2025-05-22,positive
1284,B01FVS6V9Y,Daughter enjoys it.I love it,5,2025-05-10,positive
1285,B01FVS6V9Y,"Learning.Bought for my granddaughter, who is 2. This is great with many activities to do. She loves it.",5,2025-04-24,positive
1286,B01FVS6V9Y,Playful but learning as well.My Granddaughter loves this,5,2025-04-19,positive
1287,B01FVS6V9Y,Fun.Great,5,2025-04-12,positive
1288,B01FVS6V9Y,Good quality.Great gift for my niece she loved it and it taught her so much,5,2025-04-10,positive
1289,B01FVS6V9Y,Great activity desk.This is a must have. Very educational for your toddlers.,5,2025-03-29,positive
1290,B01FVS6V9Y,Useful.Useful,5,2025-03-27,positive
1291,B01FVS6V9Y,Table.Great learning for kids,5,2025-03-17,positive
1292,B01FVS6V9Y,I love.Very good,5,2025-02-17,positive
1293,B01FVS6V9Y,Keeps kids engaged for hours!.Can keep kids engaged for hours. Do buy the activity sheets pack with this.,5,2025-02-5,negative
1294,B01FVS6V9Y,Veteck desk.Great for language learning,5,2025-01-31,positive
1295,B01FVS6V9Y,"She can learn so much from this, she is 3 and calls it her computer.She really loves it.",5,2025-01-24,positive
1296,B01FVS6V9Y,"Awesome multipurpose table.This table provided awesome learning activities for my daughter when she was growing up. She used it to learn, draw, eat and play. The fold up clip on the back allowed for her to improve her handwriting dexterity at a young age.",5,2025-01-21,positive
1297,B01FVS6V9Y,"Easy to navigate.My young child can navigate it very well! The sound is very clear, and it’s engaging!",5,2025-01-13,positive
1298,B01FVS6V9Y,"Kiddo is happy moma is happy the cat is happy so that makes me happy.My crazy kiddo loves to bang on this table, and use the seat as a step stool, and that entertains the cat. My wife is happy the kiddo found a new thing to climb and that makes me happy. Our future astronaut and rock climber's 16-month-old daughter is making good use of this thing.",5,2025-01-13,positive
1299,B01FVS6V9Y,"Learning desk for toddler.The media could not be loaded.I absolutely love this for my 2 year old! It keeps him busy throughout the day. It comes with 6 different double sided activity sheets. It has a chalkboard when you open the desk also. It teaches a lot for young growing minds. Good sound quality, cute and fun activities. The best part is it's interactive!",5,2025-01-12,positive
1300,B01FVS6V9Y,Christmas gift.Entertaining and great learning tool.,5,2025-01-12,positive
1301,B01FVS6V9Y,2 year old approves.I bought this for my 2 year old on his birthday and he loves it.,5,2025-01-10,positive
1302,B01FVS6V9Y,"Makes learning fun.The learning desk is a wonderful educational tool for toddlers! It’s sturdy, colorful, and packed with engaging activities that keep my child entertained for hours. The interactive features, like buttons, sounds, and lights, make learning letters, numbers, and shapes fun and exciting. My grandson loves pretending to write and explore different modes of play. It’s a great investment for both learning and playtime!",5,2025-01-9,positive
1303,B01FVS6V9Y,👍.👍,5,2025-01-3,negative
1304,B01FVS6V9Y,Great learning tool.Table works great! Great learning tool,5,2025-01-1,positive
1305,B01FVS6V9Y,Love this activity desk!.My granddaughters love this desk! Very easy to assemble too!,5,2024-12-29,positive
1306,B01FVS6V9Y,Top tier educational toy.Lots of people buy children the “fun stuff” for their birthdays and holidays. But I always like to get them things that help stimulate their young developing minds. I bought this for my granddaughter and she loved it!! It just helped to reinforce what she was already being taught and helped prepare her to stand out when she started school.,5,2024-12-28,positive
1307,B01FVS6V9Y,we love it.we love this easy to put together great buy,5,2024-12-28,positive
1308,B01FVS6V9Y,"Totally worth buying.My 27 month old baby girl loves it, she barely talks but she seems very interested in learning with this tableVolume is loud and clearChair is in the perfect height for my baby girlI would 1000% recommend",5,2024-12-27,positive
1309,B01FVS6V9Y,"Very good.It’s easy to use my 2 year old loves it it teaches her very thing , the sound quality is good",5,2024-12-26,positive
1310,B01FVS6V9Y,Great.Perfect for my granddaughter shes 3 and she loved everything about it,5,2024-12-25,positive
1311,B01FVS6V9Y,Happy.,5,2024-12-25,positive
1312,B01FVS6V9Y,Timeless.I purchased the first one 2021. Baby brother came along and purchased another one. Granddaughter’s big enough and kids are just drawn to it! They play along with the various learning sheets.They even have snack time on it. It’s easy to clean and sanitize. I like the fact it’s not an iPad or cellphone.,5,2024-12-24,positive
1313,B01FVS6V9Y,Perfect birthday or Christmas gift.This table is so cute and easy to put together. The size and weight are perfect for kiddos and the touch screen works well. The toy is bright and scratch resistant and the music is fun. It is an engaging and fun toy for kids of all ages,5,2024-12-16,positive
1314,B01FVS6V9Y,"Vtech touch and learn.This is great for ages 2 and up. This is very easy-to-use, and the brightness allows children to see pictures clear. The size is perfect for  my 3 year old, and it's safe and cute.",5,2024-12-14,positive
1315,B01FVS6V9Y,We absolutely love the desk!.My toddlers 1 && 3 love this desk! Keeps them interacting and entertained while learning. They fight over it constantly! So if you have two toddlers buy two! Or even if you have a baby and toddler. Babies stage goes by fast!,5,2024-12-12,positive
1316,B01FVS6V9Y,Christmas present.Love it,5,2024-12-7,positive
1317,B01FVS6V9Y,Is good for many ages..My grandsons have been playing with this for several years now due to the different activities offered.,5,2024-12-3,positive
1318,B01FVS6V9Y,Works great.I purchased this for my niece with extra mats. Can’t get just stop using it. It is educational and she’s a smart little girl. She’s able to use this by herself and has so many things to teach her.,5,2024-11-26,positive
1319,B01FVS6V9Y,Value for my money.I got this for my sons first birthday and I still do have it. I wish the cartridges and other stuffs for the desk was easier to come by but my son loves it,5,2024-11-10,positive
1320,B01FVS6V9Y,Learning.Easy to use very helpful great early learning tool.,5,2024-11-9,positive
1321,B01FVS6V9Y,Perfect Birthday Gift.Our 2 yr old loves this!!!!,5,2024-11-3,positive
1322,B01FVS6V9Y,V tech table.My granddaughter is a year old she really enjoys this product,5,2024-10-25,positive
1323,B01FVS6V9Y,"Mi hija ama esta mesita !♥️.Ella disfruta sentarse a aprender es tan adecuada que la ama desde el 1 de día, fue un excelente 💝 regalo",5,2024-10-25,negative
1324,B01FVS6V9Y,V tech desk.Wonderful product!  Would recommend for any young child!,5,2024-10-12,positive
1325,B01FVS6V9Y,Amazing product for 2-5 year olds.I thought this my be a little advanced for my two-year-old  but he is so happy to sit at the desk and is actually learning.,5,2024-10-9,positive
1326,B01FVS6V9Y,"Design and quality.I bought this for my grandson, he really likes it.",5,2024-09-9,positive
1327,B01FVS6V9Y,"Excelente para niños pequeños.Un regalo para mi nieta, le gustó mucho",5,2024-09-7,positive
1328,B01FVS6V9Y,"VTech learning tools are so good.Got this for my 2 year old grandson.  This is a superior buy.  There are so many activities on this, and my grandson was enthralled with learning. There are extra decks you can buy as well. This is a must have. Built very sturdy and the appearance is really nice. Very stable as well. Perfect kid size.",5,2024-09-1,positive
1329,B01FVS6V9Y,Awesome.Love the variety of learning activities. My grand baby loves it,5,2024-08-26,positive
1330,B01FVS6V9Y,My Niece Loved This Gift.My niece is 2 years old and has already picked up the alphabet and some colors. Great learning toy for toddlers,5,2024-08-25,positive
1331,B01FVS6V9Y,Daughter loves it 😍.Absolutely love it. Just as described. Beat my expectations by far. My 14 month old loves it. Adorable color. Just the right size for her. TONS of ongoing activities and fun. Sturdy. Durable. Great quality. Great value. Easy to use. Highly recommend. Great gifting item!!!,5,2024-08-15,positive
1332,B01FVS6V9Y,Kid loves it.Grand daughter loves it,5,2024-08-6,positive
1333,B01FVS6V9Y,Fantastic.My kid loved it ! Not really loud but verrryyy helpful  with learning,5,2024-08-2,positive
1334,B01FVS6V9Y,"Fun.My kids all love this little desk. It is educational and the additional packs you can buy, make this even better.",5,2024-07-24,positive
1335,B01FVS6V9Y,My nephew loves it!.I bought this for my nephew's 3rd birthday. He absolutely loves it!!,5,2024-07-23,positive
1336,B01FVS6V9Y,Kid enjoys.My niece loved the activities and enjoys,5,2024-07-23,positive
1337,B01FVS6V9Y,this activity desk was a WONDERFUL gift!.I will buy this desk again!kids loved it and all the things they can do!I loved it too. its fabulous!I still want o be paid for my reviews!,5,2024-07-22,positive
1338,B01FVS6V9Y,Fun learning tool for kids!.This table works great and it works with our expansion pack! It looks very nice and has the colors my daughter wanted.,5,2024-07-5,positive
1339,B01FVS6V9Y,2 yr grandson loves it!.I bought this as a birthday gift for my 2 yr grandson.  I’m told he really likes it!,5,2024-06-20,positive
1340,B01FVS6V9Y,a great gift.my niece whom i bought this for loved it ! thank you electra,5,2024-05-17,positive
1341,B01FVS6V9Y,V tech desk.It was what I was looking for to replace my son’s first one. It’s exactly like the first one. I’m very pleased with this order.,5,2024-05-15,positive
1342,B01FVS6V9Y,Kid loves it.Easy to assemble. My kid loves it.,5,2024-05-13,positive
1343,B01FVS6V9Y,Great.The kids love it. And it helps both my 3yo girls learn.,5,2024-05-9,positive
1344,B01FVS6V9Y,Great.Had it for a long time he loves this toy,5,2024-05-8,positive
1345,B01FVS6V9Y,My dream came true!.Now I can teach my daughter English! Because she doesn't speak it. Thanks!,5,2024-04-25,positive
1346,B01FVS6V9Y,Grand baby runs to his learning desk daily.Grand baby runs to his learning desk daily. Fun activity desk. Baby loves to learn with VTech,5,2024-04-20,positive
1347,B01FVS6V9Y,Great learning toy.My grandson loves it it!,5,2024-04-13,positive
1348,B01FVS6V9Y,Sturdy!!.My kids have the orange and blue one that I got gifted to me and that one still works. They jump off it and all 😂😂 I bought this one for my 2 yr old cause they always fight over it. They even walk on the inserts and those still look new it’s been 5 days. The table comes with two inserts for the table already ! And you can buy the pre k and other packs. The volume buttons are a plus.,5,2024-04-12,positive
1349,B01FVS6V9Y,"little activity set.I bought this little activity set as a birthday gift for my grandson. He absolutely loves it. Very educational, entertaining, and fun. Lots of learning for years to come. It’s very colorful and durable!",5,2024-04-7,positive
1350,B01FVS6V9Y,Engaging.Has many activities. The music and sounds are clear and adjustable volume. Has different modes and plays that keeps the kid engaged for hours.Great way of play and learn without screen time.Worth every penny,5,2024-04-7,positive
1351,B01FVS6V9Y,Mi nieta lo disfruta mucho.Esta muy contenta,5,2024-04-4,negative
1352,B01FVS6V9Y,"Great buy.I bought this for my daughter almost 2 years ago and she still uses it! She turned 3 a few days ago and even after all the new presents and toys she's still using it, so I'd say it's a great buy.",5,2024-04-4,positive
1353,B01FVS6V9Y,Great.Brought this item three times it kept my grandchildren occupied didn’t have to worry about them writing on walls anymore. Now I’m going for a fourth great grand.,5,2024-04-4,positive
1354,B07PLG93NS,"Waste of money.Ive had this for 2 weeks, and its been lightly used. Now it won't turn on.. waste of money.",1,2026-01-12,negative
1355,B07PLG93NS,Won’t turn on - less than 3 months old.Just bought this less than 3 months ago and now it won’t turn on. Too late to return. Definitely won’t buy from this seller again. I was planning on buying a second one in a few months for my other child but not if it stops working in only a few months.We absolutely loved it until it shut off. Very disappointed 😔,1,2026-01-6,negative
1356,B07PLG93NS,"Easily breaks and malfunctions..Was a Christmas gift from my uncle and the same day he opened to use it, the screen cracked and the touch screen isn’t working. So fragile and poorly made for toddlers.",1,2025-12-29,negative
1357,B07PLG93NS,No.Not worth it. Can’t do much as a parent I’ve browsed myself to figure it out but its not teaching anything.,1,2025-12-28,negative
1358,B07PLG93NS,"Save your money and purchase something else.These are incredibly slow and hard to use, even as an adult trying to help my toddlers. I purchased two of the exact same, and they both have different apps/programs that the other does not.The fact they want you to pay a monthly subscription for it is a joke.The only positive feature about this tablet is if your trying to keep your kids away from tablets and screen time- then this will certainly make them not care about it. If I offered this tablet or a coloring book, they would 100% pick the coloring book.Save your money and get something else.",1,2025-12-27,negative
1359,B07PLG93NS,"Screen damaged easily.Lasted less than 24 hours. It comes with a pen that doesn’t have a good tip, that broke and the metal shaft scrapped into the screen making it unusable.",1,2025-12-26,negative
1360,B07PLG93NS,Do not recommend.Had problems setting it up from opening the package. Got great reviews why I bought it. Immediately regret,1,2025-12-25,negative
1361,B07PLG93NS,Dirty.Well I know for a fact that I did not buy this used and it came used. It was dirty and missing things. Extremely disappointed because I paid full price for it. And without realizing it my daughter opens it on Christmas and it's past my window for return.,1,2025-12-25,negative
1362,B07PLG93NS,Zero stars.Purchased this for my grandson's. They've had it less than two months and it will not keep a charge.  Cannot reach anyone for a return or Customer Service.  Had to do a 1 star rating because it would not let me send a review with zero stars,1,2025-12-22,negative
1363,B07PLG93NS,"screen is extremely fragile - do not buy..screen cracked under normal handling within first 2 weeks - contact leapfrog support and they said not covered under warranty, which is understandable, however the prodcut should be made much better. I can toss around an i paid or fire tablet and handle it very rough and it will not break over many years....",1,2025-12-11,negative
1364,B07PLG93NS,Broken.Glad I opened it before wrapping it for Christmas. The “shatterproof” screen was cracked. Would never know without opening.,1,2025-12-3,negative
1365,B07PLG93NS,Not a new item! Previously opened!.Purchased new item and received a box that was previously opened with the seal cut. I have no idea if everything is in the box.,1,2025-11-27,negative
1366,B07PLG93NS,"Poor quality screen.This tablet does not last long. The screen breaks easily.The screen broke; they sent a replacement, and it broke again.",1,2025-11-25,negative
1367,B07PLG93NS,"No charging cord.The leap frog did not come with a charging cord. And it was for a birthday gift, so now I need to buy a cord separately. Very frustrating!!",1,2025-11-23,negative
1368,B07PLG93NS,Never worked.Never worked (electrical charging issues) just like the microscope.,1,2025-11-1,negative
1369,B07PLG93NS,"Very dangerous features!!.I think it COULD have been a good product. We really like leapfrog, so this tablet was very disappointing. There is a full internet browser on this thing that kids can access AND a camera. If you are avoiding a regular tablet based on safety concerns, do not buy this product. Why on earth does this thing have full internet access? HUGE miss on Leapfrog’s part. Also, you are prompted upon startup to purchase the Academy membership. Amazon offered a partial refund to keep the tablet and I declined. Absolutely not worth it. Protect the children and don’t buy these kinds of things.",1,2025-10-13,negative
1370,B07PLG93NS,Awful.Don’t buy this,1,2025-10-5,negative
1371,B07PLG93NS,"No gasten su dinero no vale la pena.No gasten su dinero , no vale la pena. No funcionan solo hacen que pagues y no sirve",1,2025-10-2,negative
1372,B07PLG93NS,"Save box incase.1st I bought this used,it worked okay for about 2 weeks.Then the battery will die out in less than no time.After that issue began,the tablet would charge sometimes.I kept it because I had thrown the box away but yea I am pissed at myself for getting a Used!!",1,2025-10-2,negative
1373,B07PLG93NS,"No la compren.La pantalla se rompió el primer día, que vaina tan mala. No compren esto y no se puede configurar en español estando en pleno año 2025",1,2025-09-13,negative
1374,B07PLG93NS,Pay for the leapfrog ultimate not the acadamy.This tablet isn't what it's cracked up to be. Pay the extra money and get the regular leapfrog ultimate. It doesn't require wifi to play the main system. Its also not super kid proof the screen was cracked with in 2 weeks of it being used. Do not recommend this version. Ultimate tablet all the way,1,2025-08-22,negative
1375,B07PLG93NS,Tacky Wacky Jacky- Product worked for a little bit.Bought this product in January. The item stopped working by August. Would not hold a charge. Contacted LeapFrog who extends a year warranty in their products. They tell me that Wacky Jacky is an unauthorized seller so they would not extend the warranty to me. I call a Wacky Jacky and Wacky Jacky said the leap pad only had a 30 day warranty! Needless to say. Just by the product from the official site. No one was helpful. And read the seller information on Amazon.,1,2025-08-12,negative
1376,B07PLG93NS,"Used and Not New!!.Bought this as a gift for my niece as a brand new item and when I opened the box today for the surprise, I was surprised to find that the pink leap frog was new but this green one was opened and flipped over in the package and looks used! 😡 This was not new!",1,2025-08-8,negative
1377,B07PLG93NS,"Disappointed.This leapfrog tablet was dead and previously used when received.  I’ve had to google search how to wipe it clear of pictures from the previous owners child, clean it of finger prints and smears, wipe down and untangle the power cord.  Then I’ve been prompted to subscribe to access everything fully which is an additional cost of $69.99 per year.I’ve had to wait over 20mins for the tablet to load and reboot.  Hopefully the next go around will be better than the first, or I will also be returning….",1,2025-08-6,negative
1378,B07PLG93NS,Used !!! Not new.We received one that isn’t new and it is set up for other kids,1,2025-07-26,negative
1379,B07PLG93NS,Battery life can't keep up / quit charging.Product stopped charging after 1 month of use and can't return because of 30 day disappointed and upset,1,2025-07-19,negative
1380,B07PLG93NS,Used item received.I ordered a brand new product but  received a used item with crumpled instructions and no original packaging.,1,2025-07-10,negative
1381,B07PLG93NS,"Speakers out.Speakers went out , I bought it when he was 1 now he's two that he can finally use it , speakers went out",1,2025-07-10,negative
1382,B07PLG93NS,FINGERS CROSSED our 3rd one will continue to work..I'd like to give a better review. Because while it was working my grandson loved it .  BUT it quit charging after about 2 months. I purchased another one because he loved and learned so much with it. I bought apps for it which was very easy.  Than my 2nd one also quit charging..UGH!!! I WAS DONE!!waited another few months and he really wanted his tablet and I had already purchased apps also. I felt broken about having to buy another one! ( That's 3 !)So far only about 1 month in and it's still working.I'll let you know how it goes....,1,2025-07-2,negative
1383,B07PLG93NS,"Freezes Constantly – Total Waste of Money.I haven’t even had the LeapFrog LeapPad Academy Tablet for a full month, and the issues started almost immediately. From the very first uses, it lagged so badly that it would freeze up completely. Apps take forever to open, the screen becomes unresponsive, and my child gets frustrated and doesn’t even want to use it anymore. This was supposed to be a fun and educational tool, but it’s basically unusable. For the price, I expected much better. Extremely disappointed.",1,2025-07-2,negative
1384,B07PLG93NS,Quality Poor.Very very disappointedProduct barely dropped on floor -( hardwood floor with accent rug) - screen had formed crackImmediately after device froze / and not completely malfunctioningPurchased this less then 1 month ago!I am actually very shocked on how poorly the product was made. I usually am a big fan of leapfrog productsDo not purchase this item! Poor quality,1,2025-06-28,negative
1385,B07PLG93NS,Battery.Purchased this from my grandson who loves this tablet. However after having it 2 years it doesnt keep the charge on the battery. I looked at the device to see if the battery can be replaced and it cannot. Called leapfrog customer support they stated well sorry not sorry it’s been 2 years YOU will have to replace it by purchasing a new one.,1,2025-06-25,negative
1386,B07PLG93NS,My son broke just i n two days..My son doesn’t like it.,1,2025-05-20,negative
1387,B07PLG93NS,"No sound after 3 weeks of light use.After 3 weeks of light use, out of nowhere the sound stopped working. Not sure if it’s just our model or not but it’s been no fun to deal with.",1,2025-05-19,negative
1388,B07PLG93NS,Screen cracks easily making device unusable.We bought 3 of these for our kids for Christmas.  2 screens cracked within a few months and the device no longer worked. My kids were so disappointed. I will never buy these or recommend them again.,1,2025-05-17,negative
1389,B07PLG93NS,"Used and missing charger and locked out.The media could not be loaded.Logged into someone’s random account out of the box, can’t access it because it has a parental lock, and was missing the charger. I ordered two as I have two kids, one was fine, the other is used, locked and missing a charger",1,2025-05-16,negative
1390,B07PLG93NS,"Battery does not stay charged!.Very disappointed! It will not stay charged at all and has hardly been used ever. I fully charge it and then my daughter will use it once for maybe 20-30 minutes and turn it off and next time we go to use it battery is fully dead!The first few times I kept thinking maybe she used it when I did not see or something, but no! And since I got it for a Christmas present I am sure just more wasted money as seems to happens with most things purchased now days.",1,2025-05-8,negative
1391,B07PLG93NS,"Wouldn't recommend.My son has autism so I thought this would be a perfect gift / starter tablet for him. 3 months after, it stopped working completely and customer support for both Amazon and leapfrog were unhelpful! It turned into more of major meltdowns and a nightmare then anything!",1,2025-04-21,negative
1392,B07PLG93NS,Never again.The product was open when I received it RETURNING it’s clearly been used,1,2025-04-16,positive
1393,B07PLG93NS,"No built in learning apps. Charged for all apps.I'm irritated thinking it would come with installed learning apps. It charged me for subscription that I assumed would grant me access to the learning apps. All apps appear to be over $10 and I haven't purchased any yet to confirm if they've included a safeguard to keep your child from making future purchases. Tried to get around iPad app charges but could have just let him keep using my iPad and paid for the $3 games on it.  Total deception and rip off if you ask me, but now I have it. I'll see how it works, if he likes and decide if I will have it returned",1,2025-04-14,negative
1394,B07PLG93NS,U have to buy a subscription every month.U have to pay for a subscription,1,2025-04-14,negative
1395,B07PLG93NS,"screen cracks easily.after using this 4 times, the screen shattered. the screen ""protector"" doesn't work as advertised. can't use it anymore. waste of 85.00 because it can't be fixed",1,2025-03-25,negative
1396,B07PLG93NS,"Por el precio muy mala calidad.La compré en noviembre y estamos en marzo y ya la entrada de carga no sirve, y no la puedo devolver, por qué ya se cerró el tiempo, por el precio se me hace súper mal y la carga le duraba muy poco",1,2025-03-23,negative
