review_id,ASIN,review_text,Star,review_time,sentiment
1651,B07PLG93NS,"Good learning tablet to start at early age.My 5 year old was using iPad for various learning games and videos, but he recently broke iPad. This time I did not want to give him expensive thing like iPad and LeapFrog leapPad perfectly fits the bill.It is not that expensive and made very sturdy. Tablet is covered in rubber guard case and feels well designed and sturdy. It comes with nice stylus and kick stand to keep tablet on desk. We were impressed as soon as we opened the box we were impressed with high quality hardware. However as soon as we turned the tablet ON, we were little disappointed. Screen is not as high quality as iPad and viewing angle is very poor. You need to be perfectly viewing straight. The display seems mediocre which is expected at this price point. I am not sure if LeapFrog made it in this way to protect kids eyes. My son did not mind it and did not notice much difference.With excitement, my son started exploring included games and application and in fe days, he got bored with it. Most applications are below his age and does not interest him very long. He wanted his iPad back because it was loaded with lots of learning and fun applications. You can download and buy new applications from Leapfrog store, but they seemed quite expensive. To keep interest going, I signed up for 3 months free trial for LeapFrog Academy and honestly it his hard to keep his interest going on with it. There are few reasons behind it: (1) For kids who cannot read yet, it’s not intuitive to scan through all the contents and try it out. So he needs parent support. (2) Content is not very polished yet. For example, reading the book. when you ask to read to kids, it is way too fast. (3) His familiarity with iPad and Apple Ecosystem may be pushing him back because he is not familiar with Android system.I will keep involved with him to get his interest going and see how it goes. It should be mentioned that LeaFrog Academy costs $7.99/month and can be used on any device.Overall, I thing this is great started tablet and still think that if I had a choice earlier I would have started with this rather than iPad since it is meant for kids and slowly transition him to expensive options such as iPad when he grows up.Overall, I think it is good learning tablet to start at early age.",4,2019-09-29,negative
1652,B07PLG93NS,"Good tablet, requires subscription.Like most things these days, unfortunately this tablet requires a monthly subscription in only to access LeapFrog Academy. LeapFrog Academy is an online-only service that is a digital world where your child can create an only avatar and complete different levels, working themselves through a map of different lessons.For the most part, this tablet would prefer to have internet access at all times. Luckily enough, you can save up to 24 lessons by favouriting them for offline use. This tablet does have an integrated Parental Control mode that allows you to limit access to applications, or set availability of the device.Because this is used by kids, this tablet is very rugged. The screen is plastic and there is a rubber case that will protect the tablet when it is inevitably dropped. It is very hard to crack a plastic screen, just be wary that it will scratch.Overall, this is quite good value considering the integrated applications. It is disappointing to see that there is a subscription for the Academy, however I understand that it costs money to run their servers.",4,2019-09-11,negative
1653,B07PLG93NS,"Good content. Hardware is sturdy but screen is awful..I like that the LeapPad is very simple to use. It comes with a whole bunch of games out of the box and is kid-proof both in terms of the content and durability. Content is locked down tightly and the bumpers are good enough to withstand moderate drops or bumps. The kickstand is pretty durable and does a good job even on carpet.The screen is quite awful and washed out but does the job for kid use... it gets pretty washed out if you want to look at the screen together though.You'll need to subscribe to the Academy to make the most of this tablet. The three month trial included is appreciated and you can make up your mind for yourself. It's a pretty reasonably priced in my opinion but the content is really geared towards younger kids.I think that if you think of this as a tablet and compare it against the Fire tablet, you'll be sorely disappointed. But if you compare this against a string of $75 playsets, you'll find that this is a terrific value.",4,2019-09-7,positive
1654,B07PLG93NS,"Perfect For Preschoolers, Pricey App Store.For its price point, this is a pretty good tablet. It comes with all you need to get started, including protective bumpers and a stylus. I call them bumpers because it is definitely not a case. I haven’t tried throwing it down the stairs but I don’t think that I can trust this silicone case for rough play. The tablet slides out of the case quite easily. There is a stand on the back of the case. The stylus is attached by a short cord and slides into the side of the tablet for storage. The usb port, micro SD slot, headphone jack, power and volume buttons are all located on the top of the tablet and not covered by the case. I don’t think it’s a great idea to make the micro SD slot that easily accessible to kids, I would have hidden it in a different place.The tablet works right out of the box. It is preloaded with some apps and others can be added. I’m pretty tech savvy and I still had to play around with this tablet to really understand how to get it going. I had to sign into my leapfrog account (or sign up for one if you don’t have one) and then set the limitations for the children using the tablet. You can set up a profile for multiple children and monitor pretty much everything from screen time to what they’re looking at.My children have specific apps that they love. Netflix, youtubekids, and roblox are the most important ones. Roblox can be downloaded through the amazon app store, but netflix has to be done differently. I still cannot get youtube kids on the tablet. The amazon app store is accessible through the parent portal of the tablet. The instructions that come with the leappad are very vague and I found myself online looking for videos on how to access and download different apps. Keep in mind though, that the leapfrog approved babysitting service isn’t available for the netflix app if you should download it. Your child will have access to everything.I think the leapfrog app store is expensive, more so than others. You get a three month subscription to the leapfrog academy included with the purchase of this tablet and after that it costs eight dollars a month. It’s basically a subscription to ongoing age appropriate school lessons. If you choose not to continue with your subscription, you can still access other apps on the tablet. So no, it doesn’t render the tablet useless.The home screen is pretty interactive, and it is really easy to navigate. There is also a voice that explains things as you go. There is a camera on the front and back of the unit, pictures are good quality. The screen is okay, it’s said to be shatter resistant. You have to look at it straight on, or you can’t see what’s on it very well. It makes sharing difficult.The recommended age for this tablet is three to eight. I think its definitely more suitable for preschool and not for older kids. My older kids were over it very quickly and didn’t have much interest in the baby apps it came with (their words, not mine). The leapfrog approved content is good, but very basic so more geared towards younger. My younger kids were happy with exploring this and find it easy to play, they used the stylus a lot.Overall, I think this is a good tablet if you have a younger child and are on a budget. My children have been using ipads from the get-go and I can set a lot of the same restrictions on those with more options as far as apps go. I find the leappad extremely limited. Which is good or bad depending on who you’re purchasing it for.",4,2019-08-31,negative
1655,B07PLG93NS,Leapfrog is an amazing tool!.My son loves this! Lots of educational activities on it!,5,2026-01-11,positive
1656,B07PLG93NS,Best educational tablet with limited access to internet.Our three year old loves this! It has great parental controls and is a great first tablet before you get an android,5,2026-01-10,positive
1657,B07PLG93NS,"Impressed!.The media could not be loaded.I bought this for my son's 6th birthday and not only does he like it, but his 8 year old brother loves this thing! You are able to purchase more learning apps of your choice. This thing is pretty cool, you can even watch YouTube on the parental access (internet app).",5,2026-01-9,positive
1658,B07PLG93NS,"AN ABSOLUTE HIT !!!.I bought this as a Christmas gift for my grandson who is 3. It was an absolute hit!!! He is advanced for his age at least  I think ( he knows his numbers by looking at them and saying them, colors and has begun practicing writing his letters ) he spent hours on this and calls it his iPad.I would highly recommend this for any kid to get them ready for school!!",5,2026-01-9,positive
1659,B07PLG93NS,It's fun for him to play with.I like it for my grandson,5,2026-01-8,positive
1660,B07PLG93NS,"GET IT!.My sons won’t stop running his food truck business on there . Opted in for the $40/m membership, it’s actually worth it . The leapfrog updated automatically as his learning advances . I’ve learned myself to be patient and let him figure things out and he can amaze me . Great investment for toddler . He even enjoys taking photos and decorating his Home Screen village.",5,2026-01-2,positive
1661,B07PLG93NS,"Perfect learning tool.Highly recommend for your kids! My 3 year old got this for Christmas and he has done very well with it! I can already see a difference in the way he talks, counting, and problem solving. I can set parental controls but haven’t needed to yet. Perfect size and easily travels. You can plug in headphones for the noise too! Excellent way to get ready for preschool and do do something other than watch TV which will help them learn! We charge at night so charging time isn’t an issue. Screen quality is good. It is slower than the modern computers and smart phones but doesn’t affect use or function. For the price I think it’s excellent quality!",5,2026-01-1,positive
1662,B07PLG93NS,Easy to use.Leapfrog tablet for beginners.  Easy to use.,5,2025-12-28,positive
1663,B07PLG93NS,Great leaning tool.Prefect gift for my grandkids.  They love it,5,2025-12-11,positive
1664,B07PLG93NS,10/10.Best for teaching kids. The size is great for 5yo.,5,2025-12-11,positive
1665,B07PLG93NS,Price and size.My grandson love it big enough for him to play the screen very clear very nice color great speed enough storage go his games.,5,2025-11-19,positive
1666,B07PLG93NS,Leappad.Great size. My daughter loves it and very educational. I say is worth it's price,5,2025-11-14,positive
1667,B07PLG93NS,Great for help with reading.It’s great for kids but you do need to pay for some apps,5,2025-11-9,negative
1668,B07PLG93NS,Leapfrog.Daughter loves it,5,2025-09-18,positive
1669,B07PLG93NS,Very good.Very good,5,2025-08-25,positive
1670,B07PLG93NS,"Pink makes it better!.My 3 year old granddaughter loves her tablet. She has one at home, but this one is for Nana’s house. And it’s pink! There are so many learning games on it. I totally recommend  it. I bought the case to go with it to keep it safe from getting messed up.",5,2025-08-17,positive
1671,B07PLG93NS,Amazing refurbished purchase..Amazing refurbished purchase.Saved a lot of money over new but didn't skimp on quality. Our child loves this and plays with it daily.,5,2025-08-3,positive
1672,B07PLG93NS,"Great for toddlers!.I was hesitant to buy this for my toddler because I don’t allow iPad or any screen time besides Netflix. But this has been great for short periods of time and there’s educational value to most aspects of the games. Also it was verrrry helpful on a long flight as well. Just don’t forget to get a case for it! We bought one initially and the screen got cracked and it didn’t work, so we had to buy another one (and buy a case too so it wouldn’t happen again).",5,2025-07-28,positive
1673,B07PLG93NS,10 out of 10.Such an improvement from the old school leap frogs from back in the day. Very educational worth the purchase.,5,2025-07-7,positive
1674,B07PLG93NS,Leapfrog.Toddler loves this! Love that it tracks screen time and tells you how they’ve spent that time. Good learning content. $30/year for leapfrog academy after free trial seems worth it.,5,2025-06-25,positive
1675,B07PLG93NS,"Very excited grandparent.I could not be more pleased.  As a grandparent who wants to help grow and nurture little minds, Leapfrog was the answer.  We were looking for something we, his parents and I, could download apps. I was going to use an old Kindle of mine but it was fried.  I started looking at another Kindle BUT when I started reading reviews on the horrors of parental controls I became discouraged. Then a friend reminded me of Leapfrog.  OMG! I had totally forgotten about it. So I researched them, figured out the best one and we are thrilled.  Not only does it come with everything to get started BUT it comes with bonuses like, within 24 hours of use knows the child is left handed and moved everything to the other side of the screen out of his way, no settings had to be set up for that, thank you Leapfrog.  I have to add my grandson is only 20 months old. He's already working on phonics, language and writing.  The other plus so far is the limited access to WiFi.  His parents are excited about that.  So a big THANK YOU Leapfrog.",5,2025-06-14,positive
1676,B07PLG93NS,"Charger was missing in the second one i bought..I bought this twice. The first one was great! The second one i bought Didnt come with a charger, And its glitchy but rather than returning the device i contacted the manufacturer and they’re working with me! Thats the only reason im giving this 5 stars. I would give whoever a zero star if i could for not paying attention to what is missing in the package!!!!!!!! 👎",5,2025-05-13,negative
1677,B07PLG93NS,Kids liked.Very cool,5,2025-05-9,positive
1678,B07PLG93NS,No inappropriate adds or app purchases.So far I like it. I don't have to worry about in app purchases or whatever like on other tablets. I don't have inappropriate adds. I don't have to worry about them finding something bad on it. I was hesitant to get it the bc of how much it is. But it is nice to be able to let them play on educational games while I finish school with another child if its a particular long day. Or on a long road trip. I don't know how long it will last. My only complaint is not all the games I have will play on the other ultimates or leapfrog pads. Or vice versa. Otherwise. If you are looking for something safer ti let your kid loose on this works for me.,5,2025-05-2,positive
1679,B07PLG93NS,Thank you.Thank you,5,2025-04-16,positive
1680,B07PLG93NS,"Leapfrog.This is great for my daughter! She's only one years old, but I'm trying to teach her early! I highly recommend this!",5,2025-04-11,positive
1681,B07PLG93NS,Fav Toy!.My daughter loved it! Her new fav~~~~,5,2025-04-11,positive
1682,B07PLG93NS,"Great tablet, need replacement stylus.Love the tablet for my grandkids, how can we get a teplacement stylus?",5,2025-04-3,positive
1683,B07PLG93NS,"Years of learning.This was a gift for a little later on for my great nephew but I probably won’t be here to see him use it so I wanted to buy now because I won’t be here later. I thought it would be good for him to start learning on it and get used to it and grow into it and grow with it because there is so much that it does and it will last for so long and he can use for gaming and watching movies as well as using it for learning and it will advance as he does and that’s the nice thing about it, it goes at your child’s pace. It’s bright and attractive so it catches the eye and draws a child’s attention so they want to play with it because it’s colorful and it does so many things and different things. . It has great sound, apparently it’s freeze resistant, the size is good for kids and there are guards on the sides to protect it if it’s dropped, they were thinking of kids or me when they designed this. You can get cases for these too in assorted colors and styles. Now you can start when they’re young and let them get used to it because it works with them on their level and progresses with them so it sort of grows with them and adapts along with them. The features are pretty amazing. I bought one of these for my stepdaughter over 20 years ago and they have come a long way but they were still very impressive then and that’s why I bought this one for my nephew because they are a great learning tool.",5,2025-04-2,positive
1684,B07PLG93NS,"It’s really a kid friendly tablet..I don’t allow my children to have tablets and iPads due to the lack of parenting controls. The access to brain rot such as coco melon , YouTube shorts, the brain rot you see on YouTube kids even. This is totally different. They replaced brain rot apps and videos with learning videos full of skills to teach before or even while they’re ins school. My son is 7 and we can switch the profile to more age appropriate for him, while not having to stress him watching nonsense. It helps keep him ahead for school, & we can still moderate the time as well. If you’re a parenting parent, 10/10 recommend",5,2025-03-22,positive
1685,B07PLG93NS,"Great for toddlers first iPad!!.This leapfrog leap pad does what it should. Long lasting battery life= long lasting fun and learning. It was very easy to set up. Parent control. It has decent amount of storage. My 4 year old son loves it. It has different apps and also demos. You have the option to buy games on the leapfrog app store. Also you can purchase leapfrog academy for $30 a year. Definitely worth it as it teaches your child from pre-k to grade 12. You can set what school level there at and it shows what games they can play. Pre-k games are like matching colors and shapes, counting, tracing letters and ect. They also can watch videos. More fun for a visual learner with counting it shows the numbers while they count. It has perfect brightness and sound. It is freeze resistant depending on the wifi connection. It's just as described. It doesn't come with headphones. Also it doesn't have Bluetooth. But I recommend it has a lot for the price. Definitely worth it for learning fun and definitely worth buying the leapfrog academy. You and your child will love it, You won't be disappointed 😍",5,2025-02-12,positive
1686,B07PLG93NS,Laptop.Granddaughter loves it,5,2025-02-7,positive
1687,B07PLG93NS,"Love.Grandchildren loved it very durable, taking it on their trip",5,2025-02-7,positive
1688,B07PLG93NS,Love it!.Kids absolutely love it!,5,2025-02-6,positive
1689,B07PLG93NS,"Very helpful and educational..This tech is perfect for the little ones that are learning, but doesn't need any distractions. Much better then the YouTube learning shows.",5,2025-02-6,positive
1690,B07PLG93NS,Great tool for learning and play..Bought these for my kids 2&4. 4yr old did best with it. It's a bit much for 2yr old specifically because they don't understand electronics break. Bought these a couple yrs ago and they are still working and kids love them. I like that most of the apps are educational.,5,2025-02-5,positive
1691,B07PLG93NS,"Does its Job.I bought this as a late Christmas present for my niece and she love it. I brought some games and learning videos in the app store that come with it. She is learning a lot and slowing improving. The Screen quality is great, the battery life usage is great(6+ hour) , Wifi connectivity is good, and the touch screen is responsive. Overall pretty great product for me.",5,2025-02-3,positive
1692,B07PLG93NS,Excellent.Excellent,5,2025-02-3,positive
1693,B07PLG93NS,Joanne review.My great grandson loves it. Very educational for toddlers.,5,2025-02-2,positive
1694,B07PLG93NS,Safe and educational.nice way to learn without the risk of the internet wide open.  They can use it in the car or on the toilet alone.,5,2025-02-1,positive
1695,B07PLG93NS,"Great for my learning toddler.We are enjoying this product so far with no issues, my daughter is two and we downloaded a minnie mouse game and got fun puzzle games. So far we are enjoying it!",5,2025-01-29,positive
1696,B07PLG93NS,"Payment after payment.You'll have to pay for an academy membership, then also pay for every app, and every song, etc. Gets pricey.",5,2025-01-27,positive
1697,B07PLG93NS,"Perfect!.I got this for my niece for Christmas and she loves it. My sister and I love it too because not only is it fun it's also educational. It holds up great to falls with the bumpers. The leapfrog academy wasn't as expensive as I thought it would be so I went ahead and got it for her as well. Battery seems to hold up well as well, it comes with a stylus attached to it which is nice because we don't have to worry about her losing it. It was very easy to set up as well.",5,2025-01-25,positive
1698,B07PLG93NS,Fun.My son loves it!!!,5,2025-01-15,positive
1699,B07PLG93NS,Held up extremely well.I bought this for my daughter quite a few years ago and it is still holding up very well. She loves it.,5,2025-01-12,positive
1700,B07PLG93NS,Tablet.We bought this for a six year old girl. She asked for it for Christmas. We help the community this time of year. The tablet is exactly like the ones in the stores. The size looks perfect for the little girl. There are games for her to play and lots of learning activities.,5,2025-01-11,positive
1701,B07PLG93NS,"Toddler Christmas Present.Got this for my toddler son, he loves it. Play with it everyday. It has parental control so you can monitor and set screen times. Great product",5,2025-01-5,positive
1702,B07PLG93NS,Love this!.It’s a wonderful device for learning! Especially for preschoolers. It has all the essentials from math to learning words. Great buy!,5,2025-01-3,positive
1703,B07PLG93NS,Great gift.My grandson loved this toy the best,5,2024-12-31,positive
1704,B07PLG93NS,Tablet.The kids really enjoyed this they. This is great learning tool.,5,2024-12-27,positive
1705,B07PLG93NS,It works.Yes,5,2024-11-15,positive
1706,B07PLG93NS,"Good.Tired of your kids trying to take your phone to watch videos or play games? We’ll just grab you one of these and no more asking for your phone, they will play and watch learning videos and it’s awesome!",5,2024-11-14,positive
1707,B07PLG93NS,"Great for active learners.We love this. It's great for fine motor skills, easy to learn & set up. Love that you can add leap pad academy & how the apps do not need wifi!",5,2024-11-11,positive
1708,B07PLG93NS,Appropriate level material.Kids can navigate it by themselves and the material is the appropriate level without me having to constantly update or change things,5,2024-10-29,positive
1709,B07PLG93NS,Grandson loves this!!.Grandson is 2 1/2.  We needed something to take him away from passive screen time. He loves the LeapFrog.  He is drawing and coloring.  He loves the placement of stickers on his worlds and in the applications.  This will grow with him as he develops.,5,2024-10-19,positive
1710,B07PLG93NS,Great!.My child loves this device. It keeps her occupied for a bit and it’s a much better alternative than a phone in my opinion. There are a few free demos and you can also buy some games. They seem to be a bit pricy so I’d recommend getting ones your child would be more active on. I’ve not yet subscribed to leap pad academy but would like to do so in the future. It was definitely worth the buy.,5,2024-10-9,positive
1711,B07PLG93NS,Great learning apps.I bought this for my son. He had an amazon tablet for a few years and it finally died on him. I decided to go with this because of the fun play yet educational aspect of it. He loves it!! I love that he enjoys learning on it!,5,2024-09-25,positive
1712,B07PLG93NS,"Great.Great Christmas gift for my granddaughter, good learning tool .",5,2024-09-16,positive
1713,B07PLG93NS,Little cousin loves!.Smarter alternative than handing over younger children a tablet. An interactive tool to help children learn.,5,2024-09-2,positive
1714,B07PLG93NS,Love it!.Got this for my 3 year old nephew and he loves it! It works really well for him and makes him want to learn. It's also incredibly durable considering how much it can get thrown around. Couldn't recommend this enough!,5,2024-08-16,positive
1715,B07PLG93NS,This is good.Children like to play,5,2024-08-13,positive
1716,B07PLG93NS,"Bought for summer.Bought this to keep grandson working on skills this summer.  So far, he likes it.",5,2024-08-3,positive
1717,B07PLG93NS,Great product!.Great product but please be aware that I found the same thing at Walmart for $50. Amazon does not price match so it may be good to check a local store before buying.,5,2024-06-22,negative
1718,B07PLG93NS,My child was behind.My kindergartener was terrified to start first grade. Couldn’t get her letters down. We got this and downloaded the app and she soaring through them all!,5,2024-06-15,positive
1719,B07PLG93NS,Learning.Bought x2 for my grandsons my 5yr old is now counting to 50 and can spell hid first name I love learning pad will buy for rest of the grand babys,5,2024-06-13,positive
