review_id,ASIN,review_text,Star,review_time,sentiment
1,B0BRXPG99Q,Screen doesn’t work and won’t calibrate..Screen is too dark and won’t calibrate so we can’t even use the pencil portion of the toy and of course you don’t know that until you open the toy all the way up. Do not recommend.,1,2026-01-1,negative
2,B0BRXPG99Q,"The screen stopped working after a month.Super sad because my daughter received this as a birthday gift and within a month the screen stopped working and is super dim and barely visible. Worked great for a month and she loved it, so bummed it broke so quickly.",1,2025-12-13,negative
3,B0BRXPG99Q,Dont.It was damaged. The product didnt worked and look ay the picture how it came,1,2025-12-11,negative
4,B0BRXPG99Q,Screen never worked.Trash. The screen stopped working after four months (without even being used). Leapfrog has a 90 day warranty and refused to replace or return. Waste your money elsewhere,1,2025-10-17,negative
5,B0BRXPG99Q,"Very dissatisfied!.The media could not be loaded.Item came dirty, scratched and very used.. extremely disappointed!!",1,2025-07-17,negative
6,B0BRXPG99Q,"Never worked.Didn’t work, the pencil did. Nothing",1,2025-07-8,negative
7,B0BRXPG99Q,"Screen does not stay on.Gift for granddaughter.  Unfortunately does not stay lit, and return window has already passed.",1,2025-06-8,negative
8,B0BRXPG99Q,"No me funcionó..NO ERA LO QUE ESPERABA. LA DEVOLVÍ. YO LA NECESITABA PARA ALGUIEN QUE NO PUEDE HABLAR PARA QUE SE COMUNICARA, PERO NO TRABAJA.",1,2025-03-13,negative
9,B0BRXPG99Q,Just got it today and the screen does not work.The media could not be loaded.Seems like an excellent tool for kids but just got it and the screen does not work,1,2025-03-3,negative
10,B0BRXPG99Q,Didnt even last year.We haven't even had this for a year and the back light broke so you can't see the screen. Very disappointing,1,2025-02-27,negative
11,B0BRXPG99Q,Very low.I changed the batteries still very low,1,2025-01-11,negative
12,B0BRXPG99Q,HELP!!!.Everything works other than the fact you can barely see what your doing! I've adjusted the brightness but it doesn't make a difference!,1,2025-01-4,negative
13,B0BRXPG99Q,was opened before. face on screen looks like it has been ised and pencil missing.The media could not be loaded.I want a replacement that is brand NEW!!!!,1,2024-11-27,negative
14,B0BRXPG99Q,"Broken right out of the box,.Never worked and Im past the replacement window.  Was holding for a birthday and Im just a week short of returning it.  This item never worked.",1,2024-11-24,negative
15,B0BRXPG99Q,This looks like it was returned or damaged before it was shipped..When I purchased this I wanted to be new not look like a return!!!,1,2024-08-6,negative
16,B0BRXPG99Q,SOUND STOP LESS THAN 8HRS.The media could not be loaded.DO NOT BUY THIS... MY SON USED THIS FOR LESS THAN 8HRS AND THE SOUND STOPPED COMING ON. I want to return it but don't know how to because of my location,1,2024-06-28,negative
17,B0BRXPG99Q,Junk.Wherever this was made - tell them to stop. The toy was junk. Didn't work.,1,2024-06-20,negative
18,B0BRXPG99Q,"you can't hear the volume as you should,.I purchased this for my granddaughter and the volume is very hard to hear. I got this for my daughter when she was a child and love all the  Leaf Frog products and couldn't wait to get her this as well. I got it and I'm very disappointed with the product, volume on high you still could not hear it to play with it and enjoy it. I would really appreciate it if someone could contact me.DisappointmentLisa",1,2023-12-29,negative
19,B0BRXPG99Q,No sound.The media could not be loaded.I just received the device and it has no sound!,1,2023-10-16,negative
20,B0BRXPG99Q,"Used Item delivered.The product that arrived looked like it is a used toy, the buttons all worn out.",1,2025-05-13,negative
21,B0BRXPG99Q,No backlight.Backlight doesn’t work. Leapfrog tried to convince me there is no backlight for this product when all product images show a backlight and the front of the box highlights it as a feature.,2,2025-12-24,negative
22,B0BRXPG99Q,"Broken screen.Half the screen flickers like it’s been damaged. No outter package was shipped with the product, just the box itself, so I don’t know if that caused initial damage to the screen. It seems like a screen defect is common with this product though.",2,2025-05-16,negative
23,B0BRXPG99Q,Eh.Doesn’t let you program name easily,2,2025-04-29,negative
24,B0BRXPG99Q,"This COULD be great…..But it only allows you to do an activity three times before forcing you to select another activity again. So, if your child is on the letter writing activity, they can write three letters and that’s it and then it tells them to select another activity. You can select the same activity again, but you can’t just continue on without restating the activity. Why in the world would it do this? It prevents kids from being able to focus for more than 1-2 minutes at a time. My child immediately hated this after it made her pick an activity when she was focused and happily writing letters. Now she doesn’t use it.",2,2025-02-14,negative
25,B0BRXPG99Q,"Product Letters and black spots.We received the leapfrog device yesterday and I'm not understanding what's going on with the letters. It appears there are black spots or the paint is chipping. The device itself is working fine, however when the letters disappear it will be no use for learning. I've ordered 3 of these for my grandchildren ages 4 to 6, and to are artistic. We need the letters to stay visible. Thinking of cancelling pending shipping orders of the other 2 devices.",2,2024-11-19,negative
26,B0BRXPG99Q,"Touch screen does not work.Very cute learning toy. However the touch screen does not work, this ruined the appeal completely.",2,2024-11-17,negative
27,B0BRXPG99Q,"Great concept.I think it’s an effective way of learning, but I would feel better about it if the buttons on the lower right actually worked so my 4year old can do the activities.",2,2023-08-18,negative
28,B0BRXPG99Q,"Good Quality toy perfect for toddlers and cute.Only the delivery is quite late, other than that my baby like this toy. She loves it playing all the times",3,2025-11-15,positive
29,B0BRXPG99Q,No me gustó.No era lo que yo esperaba,3,2025-08-30,negative
30,B0BRXPG99Q,Poor Screen quality.Great item to keep kids busy however screen got broken easily...,3,2025-08-18,negative
31,B0BRXPG99Q,It’s ok.It’s ok for the price battery die easily,3,2025-06-4,positive
32,B0BRXPG99Q,Leapfrog review.I love that my child is learning to write his letters and numbers. He loves to learn new words. But I've only had it for 4 months and the screen is significantly scratched up and I know he is only using the pencil...,3,2025-04-30,negative
33,B0BRXPG99Q,"Great! Light brightness on screen.Love this tablet for my 4 year old learning. The brightness is my only complaint. He says it's very hard to read the screen. The learning and practice is great! The size is perfect for road trips and he doesn't seem to beg for his iPad as often, always a win!",3,2025-04-30,positive
34,B0BRXPG99Q,"Weak graphics but fulfills purpose.Great product, a bit behind on the graphics for 2025 but it still served the purpose.  If you own a tablet, there are many apps that would be much cheaper and more graphic satisfying.3 stars for the above reasons",3,2025-04-29,positive
35,B0BRXPG99Q,Fun but not Durable.My 4 year old received this for Christmas. I love the way it works and how it teacher. But it’s a kids toy which means it gets dropped more than a normal item. We’ve only had it 3 weeks & part of the screen already is not working. So my son is getting frustrated he can’t use the toy properly :(,3,2025-01-9,negative
36,B0BRXPG99Q,"Empaque deteriorado.Le doy 3 estrellas porque el empaque vino en muy malas condiciones y dicho sea de paso lo compré para un regalo.Aún dañada la caja, el articulonse encuentra en muy buen estado. No  se afectó, así que lo reempacaré para el regalo.Tiene buen peso,  buen tamaño y buen sonido.",3,2024-12-10,negative
37,B0BRXPG99Q,Damaged box.I really hope this works as it's for christmas for my 4 year old and this is how it came. So I gave a 3 star review for now.,3,2024-12-5,positive
38,B0BRXPG99Q,"The pen is thick.The pen is too thick.  I didn't consider  the small hand that would be using it, when I purchased it. not something he picks when it's time to work on alphabet.  He's 3yrs old.",3,2024-05-19,negative
39,B0BRXPG99Q,"Return window Jan 31, my luck.The media could not be loaded.Like it but weird discoloration started right before return window closed. Still works for now. But keeps acting like it needs batteries but their new. Maybe I got a bad one. But the kid likes it. Get it on sale and hopefully it last",3,2024-02-4,positive
40,B0BRXPG99Q,Slightly different.I got the green one of these from target and needed to get another one for my daughter so I found this pink one.It works great and the color is cute.Only problems are that the string is just a little shorter than the green target version. And the main problem is that the pencil is hard to get in and out of the holder (unlike the green one). So an adult has to help. So that’s annoying.The toy itself is great though. My kids love them and are good at writing their names and numbers and letters.,3,2024-01-26,positive
41,B0BRXPG99Q,Much smaller in person.Very small,3,2024-01-20,negative
42,B0BRXPG99Q,Can’t Add Every Name.The toy is fun and educational but one major complaint for us. My kiddos name contains three letters in succession that also spell a “bad word.” The tablet won’t allow you to type those letters even in the context of another word. This results in the name function not working because we aren’t able to enter the spelling of his name due to those three letters being in the middle of the name. I understand having a “filter” option to not enter certain words but not letting you type anything that even contains those letters is frustrating.,3,2023-12-26,negative
43,B0BRXPG99Q,まぁまぁ.うちの5歳と3歳がたまに遊びます。持ち運びには良いと思います。,3,2024-12-6,negative
44,B0BRXPG99Q,Cute.Does the job helps the kids learn and lots of fun? I definitely would recommend for and under,4,2026-01-6,positive
45,B0BRXPG99Q,Great toy for a five year old..My five year old LOVED THIS.The only issue is that the sound got significantly lower after a few days of playing with it even after changing the batteries.  I don’t mind the lower sound but found it strange this would happen.,4,2026-01-2,negative
46,B0BRXPG99Q,Good.Good,4,2025-12-31,positive
47,B0BRXPG99Q,Positive reinforcement provided encouraging the user to keep going..I love that you can personalize it for more than one child.  You can add more than one name to practice name writing.  We also love the positive feedback at certain points it provides and the reinforcement.  Overall great purchase the children love it .,4,2025-12-28,positive
48,B0BRXPG99Q,Great for kids.Perfect early learning tool,4,2025-12-19,positive
49,B0BRXPG99Q,"Great learnings tool with room for a couple of improvements.We’ve really enjoyed using the LeapFrog Mr. Pencil’s Scribble, Write and Read! I love that the pencil is connected in the middle, making it easy for both right and left-handed kids to use, super thoughtful design. The two volume levels are great for different settings, and being able to program up to three names is a fantastic feature. It’s helped my preschooler start learning how to spell and write his full name, which is a huge win.That said, I do wish there were more preprogrammed words for kids to practice spelling and pronunciation, it would really extend the product’s learning value. Also, the screen is tough to see in outdoor lighting, even on an overcast day under a shelter. A toggleable backlight would be a great addition.Overall, it’s a great educational toy with a lot of potential, just a couple tweaks away from perfect.",4,2025-08-14,positive
50,B0BRXPG99Q,"Great for fun. Don’t bank on it for teaching kids how to write properly.My toddler loves it. Saved us a lot of frustration on long drives. It also helped her get used to the letter shapes. She has hours of fun writing on it.It won’t teach them pencil grip and control though. I wouldn’t suggest this if you want to buy it for teaching kids how to write. This is like any other learning tablet, they can learn their letters and have fun with some drawing, but this should not be the primary tool teaching them how to write.",4,2025-06-26,negative
51,B0BRXPG99Q,Great toy / learning tool.Kept my 5 yo occupied for a 2.5 hour car ride but is so annoying to hear as a parent in the drivers seat - especially when you realize you’re singing the songs to yourself at work the next week,4,2025-06-23,negative
52,B0BRXPG99Q,"My 2.5 year old enjoys it.Works well, my 2.5 year old likes it. Good deal for 15$",4,2025-05-11,positive
53,B0BRXPG99Q,Educativo y entretenido.Es bastante útil y entretenido. A mi hijo le gusta mucho.,4,2025-05-10,positive
54,B0BRXPG99Q,"helpful learning.my child loves spending time learning on his leapfrog, following the lines and learning his number and letters better with tracing them too",4,2025-03-29,positive
55,B0BRXPG99Q,"Good for 4yr old.Lots of activities, engaging for 4yr old.",4,2025-03-19,positive
56,B0BRXPG99Q,5 yr old likes it.My 5 yr old enjoys this.  I'm hoping he will write more. Kindergarten begins next yr.,4,2025-01-20,positive
57,B0BRXPG99Q,"It’s good.I don’t love the free coloring portion of it since my kid would rather use the coloring function than the reading function, but my kiddo loves this, and he uses it all the time.",4,2024-11-19,positive
58,B0BRXPG99Q,Cute and educational.Serves its purpose,4,2024-11-13,positive
59,B0BRXPG99Q,My kid loves this.Great learning tool,4,2024-10-25,positive
60,B0BRXPG99Q,Pretty sturdy.Looks very nice but probably for a 4 year old. My 3 year old got bored of it very quickly. Good sound quality,4,2024-09-28,negative
61,B0BRXPG99Q,"School Prep Must.My 5 yo grandson had no interest in ""learning"" over the summer.  Concerned he might have a learning disability, I ordered this for him.  Mr. Pencil quickly reinforced what he learned in Pre-school.  He still grabs it after school to practice.  Not every day, but often enough that it wasn't a waste of money.",4,2024-08-24,negative
62,B0BRXPG99Q,"Small screen.Nice for toddlers, just wish the scree was bigger for writing and tracing",4,2024-08-19,positive
63,B0BRXPG99Q,"As advertised!.My kiddo didn’t love this, she just turned 4 and already has a basis on letters so I think it would be great for a kid just starting out.",4,2024-04-15,negative
64,B0BRXPG99Q,Practice.This is a nice tablet my 4 year old likes it but it has too many options and is distracting it would be nice if it only focused on letter and name writing.,4,2024-04-6,negative
65,B0BRXPG99Q,"Engaging, probably over-stimulatung.I got this when my kid started getting really interested in spelling. So far it's been great keeping him engaged with the letter writing feature. So overall positive. Be aware it's considerably on the flashing lights, constant sounds/talking, over-stimulatung side of things, which I wish would get toned down.",4,2024-02-29,positive
66,B0BRXPG99Q,It was affordable.My grandson likes it.,4,2024-02-28,positive
67,B0BRXPG99Q,Grandson loves this.Grand almost 4 really liked this,4,2024-02-5,positive
68,B0BRXPG99Q,"My 4 year olds loveeee their ""tablet"".My 4 year old twins can't get enough of their ""tablet"" (we are not a Tablet family so this is the closest they get"")I feel good about letting them play with it because its somewhat educational. its not AS educational as I hoped, because it is easy to ""cheat"" your way through the letter writing and there is a drawing game, etc. but its satisfactory.",4,2024-01-26,positive
69,B0BRXPG99Q,"Educational but not captivating.As a parent, I think this is a great toy. It is simple, educational and portable. However, it did not capture my child’s interest all that much. I’ll continue to give it a chance",4,2023-12-26,positive
70,B0BRXPG99Q,Ok.It’s ok,4,2023-11-18,positive
71,B0BRXPG99Q,"Fun and Educational.Great for keeping kids busy during long car rides, or for when you just want to keep your child entertained while at the same learning their letters.",4,2023-07-6,positive
72,B0BRXPG99Q,"Disappointed.The media could not be loaded.I’ve bought two for my girls and unfortunately this is how the buttons look after ONE DAY of using them a few minutes. For what I can see the white part inside this buttons crack every time you push them so I expect the letters and numbers to be gone by a month or less, is the cheapest quality for a such a good toy. I wanted to contact de seller but I couldn’t find any option, if the seller wants to contact me and work it out I would be willing to change my mind otherwise I’m definitely returning it.Update: I did return both and received a replacement with a better quality but still not the best quality. Still appreciate the costumer service response.",4,2025-04-10,negative
73,B0BRXPG99Q,Very educational.My girls love it 😀,4,2025-01-9,positive
74,B0BRXPG99Q,Educational.Bought for grandchild. I'm sure she will enjoy and get educated in at the same time. I'm always for educational type games/electronics as they seem to attract the kids longer,4,2024-12-9,positive
75,B0BRXPG99Q,Good learning toy.Yes good learning item,5,2026-01-12,positive
76,B0BRXPG99Q,Great item.Love it,5,2026-01-10,positive
77,B0BRXPG99Q,KING'S FIBERGLASS.I LIKE THE QUALITY AND THE VALUE OF THE MONEY THAT I SPEND. Thank-ou,5,2026-01-10,positive
78,B0BRXPG99Q,He learning on it.Is a heavy duty quality is good,5,2026-01-8,positive
79,B0BRXPG99Q,Perfect learning tool for a preschooler or elementary grade.A great little learning tool for my granddaughter she's six years old. It will help teach her to read and write and. Mathematics I'm very pleased with my purchase.,5,2026-01-8,positive
80,B0BRXPG99Q,Awesome.This is a wonderful gift for a child learning,5,2026-01-8,positive
81,B0BRXPG99Q,"Nice learning toy.Nice and good for learning, however it took a long time to arrive.",5,2026-01-7,negative
82,B0BRXPG99Q,"Amazing product for toddlers!!.I got these for my grandbabies and I am absolutely amazed with how easy they are for them to use. And....they love them! They are w and 3 years old, so these were perfect gifts for their Lil learning brains! What's even better? You can program each child's name into their own so they learn to write and spell their name!!",5,2026-01-7,positive
83,B0BRXPG99Q,"Fun and educational !.practice writing letters, numbers, spelling, and early reading. Mr. Pencil’s playful guidance keeps toddlers engaged, and the sound-it-out bar adds an interactive phonics element that makes learning feel like play. Easy for ages 3+ with personalization for name writing and animated feedback. Great for building confidence before school.✅ Pros:• Engaging letter/number tracing and phonics play• Personalized name writing• Encourages independent learning❌ Cons:• Requires frequent battery changes• Might be outgrown as skills improveStylus may be small for some hands",5,2026-01-6,positive
84,B0BRXPG99Q,Christmas gift.Great gift for a 4 year old,5,2026-01-6,positive
85,B0BRXPG99Q,Good learning tool.Bought for my 3yr old. I love that you can input the child's name to help them work on writing their name.,5,2026-01-5,positive
86,B0BRXPG99Q,Great product.My daughter is 4 and loves this so much!! She plays on it more than her real tablet and is learning so much!,5,2026-01-4,positive
87,B0BRXPG99Q,Educational.My 5 year old uses it and my 1 year old also started using it. I see them using it for a long time and it has already gone through alot of dropping and it works great. Very durable.,5,2026-01-3,positive
88,B0BRXPG99Q,Perfect gift for toddler.Perfect gift for toddler,5,2026-01-3,positive
89,B0BRXPG99Q,Super fun !.My kids love this game. Play it for hours. Bought it for my preschooler but all my little ones love it.,5,2026-01-3,positive
90,B0BRXPG99Q,Great substitute for a tablet.Great Christmas gift. Very engaging and educational.,5,2026-01-2,positive
91,B0BRXPG99Q,Great Product.My 4 year old grandson loves his new Leap Frog tablet!,5,2025-12-31,positive
92,B0BRXPG99Q,"LeapFrog Mr. Pencil’s Scribble, Write and Read.I bought this for my 3 year old and she loves it. It’s perfect for keeping her busy around the house or on short trips.",5,2025-12-30,positive
93,B0BRXPG99Q,"Very entertaining for 3 and 4 year olds..My 4 year old grand daughter loves this!  She spent an hour in a room playing this and was upset when she had to leave it at her cousins house, who is 3, because it was his.  He plays with it almost every day as well.",5,2025-12-30,positive
94,B0BRXPG99Q,Bought for a trip.I bought this for my four year old when we traveled across the country.  It kept her busy the whole trip!  She loved it and learned so much.,5,2025-12-30,positive
95,B0BRXPG99Q,Would recommend.I should have bought 2 so my boys won't fight over it. It's a little harder for my younger one to use but easier for the 4 yr old to use. I like how it talks and blinks where you are supposed to start and the direction to go,5,2025-12-30,positive
96,B0BRXPG99Q,Amazing Toy.Amazing toy. My 3 year old learned all of the letters by himself with this toy. It's his favorite toy and it's very popular amongst his siblings and cousins as well. Highly recommend.,5,2025-12-29,positive
97,B0BRXPG99Q,Great purchase.Excellent learning device for a child.,5,2025-12-29,positive
98,B0BRXPG99Q,It's great for little children.I bought one for my daughter and my niece.  They both love it. Always working one thier numbers and letters.,5,2025-12-29,positive
99,B0BRXPG99Q,Fun educational tool.Nice educational tool. I highly recommend,5,2025-12-28,positive
100,B0BRXPG99Q,Worth the money.Excellent educational toy. I liked you could put his name in and it programs it in so he can practice not only writing letters but his name,5,2025-12-28,positive
101,B0BRXPG99Q,Perfect toddler gift.Grand enjoyed,5,2025-12-27,positive
102,B0BRXPG99Q,Kid loved this.It did way more then I thought it would for thr price.,5,2025-12-27,positive
103,B0BRXPG99Q,Can add your own names for practice writing. Engaging.Was a Christmas hit with my 3 (almost 4) year old. Been having a hard time getting him engaged with reading and writing before he starts school. He loves both of his leapfrog gifts this year. He’s already working on his name (a saved feature which is neat),5,2025-12-26,positive
104,B0BRXPG99Q,Great learning toy.My 3 year old nephew cannot put this down! He absolutely loves it.,5,2025-12-21,positive
105,B0BRXPG99Q,Works perfectly!.Works perfectly! My son is going to love it. No damages.,5,2025-12-21,positive
106,B0BRXPG99Q,"Ease of use.My daughter is just now learning her letters. She’s absolutely in love with the drawing effects on this, and I cannot express the amount of excitement she has to play with this. It is nice to have something fun, but is also helping her learn I would say definitely good value for the money and it’s very easy that she can functionally use it without my help.",5,2025-12-21,positive
107,B0BRXPG99Q,Learning.Great for 2 year old and learning,5,2025-12-21,positive
108,B0BRXPG99Q,Awesome.Very loved and used toy in the household even after having it for several months now,5,2025-12-20,positive
109,B0BRXPG99Q,Great for Toddlers!.Easy to set up and use! I love that you can program up to two children's names into it for them to practice. I also like that they can use the pencil or their finger to trace the letters.,5,2025-12-18,positive
110,B0BRXPG99Q,"May be useful.The media could not be loaded.Screen isn’t very bright, the quality of it is average, my daughter thinks it’s kinda fun, it functional with alphabet and numerical learning and you can get it at an affordable price.",5,2025-12-13,negative
111,B0BRXPG99Q,10/10.My daughter LOVES this. She takes it with her everywhere.,5,2025-12-12,positive
112,B0BRXPG99Q,Yes.My friend’s kid (age 3) I bought this for loves this. Perfect on the go activity,5,2025-12-8,positive
113,B0BRXPG99Q,Great educational toy.I love this for my kids. It’s great for my 8 year old or my 3 year old. Teaches them while they have fun,5,2025-11-28,positive
114,B0BRXPG99Q,Good educational tool.Very nice,5,2025-11-26,positive
115,B0BRXPG99Q,"Love it! Would buy again in future!.Fun! Educational! Portable! Good quality! My daughter loves this! It gives the sounds for letters, you can personalize it with their name so they can learn to write it.",5,2025-11-24,positive
116,B0BRXPG99Q,"“High-Impact Learning Tool for Early Writing”.This learning device delivers strong performance for early writing skills. The interface is intuitive, the smart pencil guides each stroke accurately, and it keeps kids engaged from the start. Solid build quality, clear audio, and excellent value for the educational impact. A reliable tool for skill development with zero friction.",5,2025-11-24,positive
117,B0BRXPG99Q,amazing.great for my kids,5,2025-11-20,positive
118,B0BRXPG99Q,"Great for my 4 year old!.My 4 year old needed a little extra help with letters and writing, so i bought this and it has helped tremendously! Great price and good size where we can use it at home or bring it in the car!",5,2025-11-17,positive
